wav_filename,wav_filesize,transcript
common_voice_fy-NL_20755969.wav,243500,de twadde generaasje spiraaltsjes wie al in stik lytser as de earste
common_voice_fy-NL_21471451.wav,125996,hy stoar nei in koart siikbêd
common_voice_fy-NL_20755945.wav,188204,ik wit dat hja leaver helpt as by it selskip sitte te moatten
common_voice_fy-NL_20755948.wav,215084,de plysje hat it wapen yn it hús fûn en yn beslach naam
common_voice_fy-NL_20755963.wav,169772,hy sprong as in pylk út de bôge fan de tafel ôf
common_voice_fy-NL_20755952.wav,169004,we kinne der wol rinnende komme
common_voice_fy-NL_20755974.wav,271916,de frou rôp dat de plysje belle wie en dêrop naaiden de dieders út
common_voice_fy-NL_20755960.wav,201260,as twa minsken itselde dogge is it net itselde
common_voice_fy-NL_20755979.wav,235820,problematysk ytgedrach komt hieltyd faker foar ek by bern
common_voice_fy-NL_20755985.wav,217388,hy is hast altyd bûnt en blau omdat er safolle skopt en slein wurdt
common_voice_fy-NL_21471733.wav,189740,it ljocht moast no eins oan gean it is by fiven
common_voice_fy-NL_20755962.wav,216620,der is gjin gefaar dat de asbest yn in grutter gebiet delkomt
common_voice_fy-NL_20755987.wav,182060,binne der oare planeten dêr't libben mooglik is
common_voice_fy-NL_20755964.wav,191276,us programma giet jûn oer de sosjale wurkpleats
common_voice_fy-NL_20755976.wav,99884,nei boppen ta
common_voice_fy-NL_20755996.wav,208172,oer it hiele waad hong in floers fan damp en dize
common_voice_fy-NL_20755982.wav,185900,dy bern binne sa ûndogens kinne de âlden dat net keare
common_voice_fy-NL_20755980.wav,172844,moat ik nei it sikehûs
common_voice_fy-NL_20755971.wav,165164,nijsgjirrich is dat it skiep swart is
common_voice_fy-NL_20755975.wav,212780,pas by it jûnsappèl murken de sipiers op dat er der net mear wie
common_voice_fy-NL_20755988.wav,179756,it wie juster swier waar by ús buorlju
common_voice_fy-NL_20755989.wav,189740,skriuw de lêste fiif alinea's
common_voice_fy-NL_20756001.wav,191276,de gielgriene tried wurdt ferbûn mei it ierdkontakt
common_voice_fy-NL_20755986.wav,165164,se sizze dat hy de rykste man fan it doarp is
common_voice_fy-NL_20755965.wav,211244,de seehûnegryp hat foar in soad sike en deade bisten soarge
common_voice_fy-NL_20755991.wav,231212,op tiisdeitemoarn is der in aardige merk yn it sintrum fan de stêd
common_voice_fy-NL_20755995.wav,207404,doel is om de leefberheid yn de doarpen oan te pakken
common_voice_fy-NL_20756002.wav,144428,wy hiene wol wat oars oan 'e holle
common_voice_fy-NL_20756007.wav,162860,temperatuer op it stuit thús
common_voice_fy-NL_20756000.wav,130604,wat is dat djoer
common_voice_fy-NL_20755994.wav,193580,ik jou my by in selskip dat bestiet út trije famkes
common_voice_fy-NL_20756006.wav,171308,hy krige te hearren dat er slim siik wie
common_voice_fy-NL_20755992.wav,204332,ik haw genôch fan dyn spyt jou my no wat fan dyn jild
common_voice_fy-NL_20756004.wav,221228,de boargemaster ropt op om in brânende kears foar it raam te setten
common_voice_fy-NL_20755999.wav,232748,hjir leit myn ynspiraasjeboarne yn dit hele keale lânskip
common_voice_fy-NL_20755998.wav,222764,in grut part fan it doarp is op dit stuit net goed genôch beskerme
common_voice_fy-NL_20756003.wav,215084,sy is in kwike kleastersuster dy't nei de sechstich giet
common_voice_fy-NL_20755972.wav,270380,net allinnich de feilichheid fan de polysjeminsken rint gefaar dy fan boargers ek
common_voice_fy-NL_20756014.wav,239660,wa't sels net jout om duorsumens kin oaren min op duorsumens fergje
common_voice_fy-NL_20756013.wav,234284,kinst der gau eefkes wat ite yn ien fan de yttintsjes
common_voice_fy-NL_20755981.wav,176684,as it freeds reint dan sjocht men sneons gjin mins
common_voice_fy-NL_21415563.wav,109868,dat fertrou ik ek wol
common_voice_fy-NL_20755954.wav,280364,jonge slaadplantsjes kinne fan begjin maart ôf yn 'e folle grûn útplante wurde
common_voice_fy-NL_20756016.wav,153644,stjoer albert in whatsapp berjocht
common_voice_fy-NL_20755990.wav,205100,hja barste hielendal útinoar fan lilkens
common_voice_fy-NL_21415636.wav,165164,no ja foar ien kear hawwe de offisieren it by de rjochte ein
common_voice_fy-NL_21415637.wav,107564,fideo foarkant
common_voice_fy-NL_21415565.wav,244268,minsken litte it knalfjoerwurk faker links lizze en kieze foar it moaiere fjoerwurk
common_voice_fy-NL_21415560.wav,175148,tige tank foar jo help mar dit is net wat ik sykje
common_voice_fy-NL_21415564.wav,103724,skerm út
common_voice_fy-NL_21415562.wav,228908,twa dagen sûnder ein wisket der poeiersnie oer de wite wrâld
common_voice_fy-NL_20756011.wav,247340,al dy âlde izeren buorden binne himmele en kreas yn de kachelpoets set
common_voice_fy-NL_21415634.wav,94508,wat kostet it
common_voice_fy-NL_21415651.wav,140588,hy komt altyd as in oar der al west hat
common_voice_fy-NL_21415648.wav,222764,nei âldjiersnacht sil de hoareka yn petear gean mei de gemeente oer de slutingstiden
common_voice_fy-NL_20756009.wav,137516,ik wol dy hjir net wer sjen
common_voice_fy-NL_21415658.wav,99884,we wurde in dei âlder
common_voice_fy-NL_21415664.wav,109868,hoefolle gram is ien ûns
common_voice_fy-NL_21415646.wav,126764,in bankoerfal bart net alle dagen
common_voice_fy-NL_21415675.wav,122924,kinne jo it yn in pear wurden beskriuwe
common_voice_fy-NL_20756012.wav,255020,wy krije alle dagen fragen oft it noch mooglik is om wedstriidkaarten te keapjen
common_voice_fy-NL_21415647.wav,121388,hjoed in wike hâlde wy in feest
common_voice_fy-NL_21415657.wav,192044,minsken dy't altyd kleie binne negatyf en sille nea wat berikke
common_voice_fy-NL_20756017.wav,178220,nei it optreden krigen hja in lang applaus
common_voice_fy-NL_21415638.wav,84524,binne wy der hast
common_voice_fy-NL_21415673.wav,178988,it moadetydskrift sjocht har as in foarbyld foar de moderne frou
common_voice_fy-NL_21415649.wav,157484,moandei kamen se oan en hawwe se de petysje oerlange
common_voice_fy-NL_20755983.wav,155180,wit ien ek wat dat drege wurd betsjut
common_voice_fy-NL_21415690.wav,138284,der komt hiel wat oan te pas om dizze funksje út te oefenjen
common_voice_fy-NL_20756010.wav,170540,ik begryp dat soks amper oan 'e oarder is
common_voice_fy-NL_21415671.wav,157484,in spiler mei op gjin inkelde wize rûch of mei geweld spylje
common_voice_fy-NL_20755966.wav,265004,oan de bar rekket hja wakker yn petear mei in donkerhierrige jonge
common_voice_fy-NL_20756008.wav,143660,dat binne ús freonen
common_voice_fy-NL_21415698.wav,130604,stel ôfdrukgebiet yn op seleksje
common_voice_fy-NL_21415633.wav,169004,der is wol in hele soad oer skreaun en oer praat
common_voice_fy-NL_21415672.wav,182828,it gjers wurdt oanfretten en it lân fan de boeren sit fol gatten
common_voice_fy-NL_21415697.wav,140588,hy woe mar sizze dit komt te ûnferwachts
common_voice_fy-NL_21415688.wav,109868,ien kear moat de earste kear wêze
common_voice_fy-NL_21415696.wav,94508,wêr kin ik de auto kwyt
common_voice_fy-NL_21415709.wav,126764,de gaazjes wienen op amateurbasis
common_voice_fy-NL_21415700.wav,109868,dêr wurdt it wat moaier fan
common_voice_fy-NL_21415715.wav,161324,hiel wat doarpen ha der de lêste jierren in protte nijbou by krige
common_voice_fy-NL_21415725.wav,107564,belje tineke op kantoar
common_voice_fy-NL_21415721.wav,109868,ferbergje de foarige kolom
common_voice_fy-NL_21415699.wav,90668,oant sjen
common_voice_fy-NL_21415674.wav,186668,mei skodoarren wurdt romte besparre sawol bûten as yn de kast
common_voice_fy-NL_21415689.wav,198188,by in grutte brân is âldjiersjûn de loads fan in reidtekkersbedriuw ferlern gien
common_voice_fy-NL_21415723.wav,136748,dat is allegearre al ris earder bard en it sil op 'e nij barre
common_voice_fy-NL_21415714.wav,107564,it sikehús stiet oanjûn
common_voice_fy-NL_21415746.wav,198188,petearen mei stjerrenden kinne it bêste ûnder fjouwer eagen hâlden wurde
common_voice_fy-NL_21415686.wav,178988,wy wolle noch graach in neigesetsje meie wy de kaart noch efkes sjen
common_voice_fy-NL_21415748.wav,176684,oerenlang gongen wy dêr op en del mei de roltrep of de lift
common_voice_fy-NL_21415711.wav,205868,de frijetiidsyndustry foarsjocht yn in breed skala oan kant en kleare útstapkes
common_voice_fy-NL_21415713.wav,169004,de figueren yn dat boek meitsje alles wol in ein dúdliker
common_voice_fy-NL_21415789.wav,199724,dy rykdom fine wy werom yn kostbere objekten dy't yn it grêf meijûn waarden
common_voice_fy-NL_21415750.wav,172844,hy lient tenei syn bekende namme ek oan in parfum foar froulju
common_voice_fy-NL_21415765.wav,153644,yn it echt sil hja nea sa kreas wêze as yn myn holle
common_voice_fy-NL_21415763.wav,203564,nei it mitseljen kin men de blokken gewoan bypleisterje en fervje of behingje
common_voice_fy-NL_21415775.wav,99884,hy wennet in eintsje fan 'e dyk ôf
common_voice_fy-NL_21415805.wav,126764,by myn witten is er earlik
common_voice_fy-NL_21415796.wav,153644,juster haw ik belle mei in âlde freon in stúdzjegenoat
common_voice_fy-NL_21415727.wav,163628,op dy tiisdei dat it sa waarm wie hawwe wy mar even neat dien
common_voice_fy-NL_21415785.wav,145964,hja seit dat se har húswurk makke hat en hellet in trije
common_voice_fy-NL_21415764.wav,102188,seleksje rjochts útwreidzje
common_voice_fy-NL_21415800.wav,188204,as pleechgesin krije jo in begelieder tawiisd dy't jo stipet en begeliedt
common_voice_fy-NL_20756005.wav,266540,ik hie wol in soad bedriuwsûnderfining mar wist neat fan psychology en sosjology
common_voice_fy-NL_21415772.wav,153644,sy is europeesk rekôrhâldster op de triatlon
common_voice_fy-NL_21415773.wav,106028,wim wurdt ús nije meiwurker
common_voice_fy-NL_21415788.wav,106028,nij e mailberjocht meitsje
common_voice_fy-NL_21415798.wav,144428,dan wie it mar in stapke en dan wienen se hjir yn it kafee
common_voice_fy-NL_21415662.wav,103724,dy jonge moat better stjoerd wurde
common_voice_fy-NL_21415761.wav,129068,ik hie eigentlik wol it teäter yn wollen
common_voice_fy-NL_21415804.wav,161324,yn it museum is snein in bysûndere tentoanstelling iepene
common_voice_fy-NL_20760165.wav,305708,ferhalen binne as planten se ûntwikkelje in ûnbidich tal woartelhierren eardat se sichtber wurde
common_voice_fy-NL_21415802.wav,134444,de jonge fleach út de baan en lei yn de sintels
common_voice_fy-NL_21415762.wav,117548,nei in pear dagen berikke wy ús bestimming
common_voice_fy-NL_21415799.wav,130604,ferskate jongeren binne trappearre
common_voice_fy-NL_21415801.wav,182828,hast tachtich ynsprekkers hawwe har oanmeld foar de ynsprekgearkomsten
common_voice_fy-NL_20760169.wav,155180,hy kaam deryn en die de doar efter him ticht
common_voice_fy-NL_20760163.wav,288812,ik ha al de hiele dei ôfgryslike pineholle
common_voice_fy-NL_21415747.wav,140588,der stjitte wat ûnder tsjin de boat oan
common_voice_fy-NL_20760166.wav,129836,de wynhoas is foarby
common_voice_fy-NL_21415786.wav,134444,by de ynstelling wurde tsientallen banen skrast
common_voice_fy-NL_21415803.wav,132908,ferheegje temperatuer plus trije graden
common_voice_fy-NL_20760231.wav,115244,fierder kin ik der neat fan sizze
common_voice_fy-NL_21415797.wav,171308,sint piter bringt healwei febrewaarje wer syn besite oan grou
common_voice_fy-NL_20760168.wav,202796,it politike bestel as sadanich is oan in yngeande feroaring ta
common_voice_fy-NL_20760258.wav,203564,leafhawwers fan fjurwurk moatte noch al efkes wachtsje mei it ôfstekken
common_voice_fy-NL_20760183.wav,151340,sis tsjin nicolas moai songen
common_voice_fy-NL_20760212.wav,170540,de winkelstrjitte hat de hiele dei sonder wetter sitten
common_voice_fy-NL_20760285.wav,178220,de wei is fanwegen it wurk dit hiele wykein ticht
common_voice_fy-NL_20760230.wav,217388,dêr moatst net om laitsje dat is heel slim
common_voice_fy-NL_20760256.wav,178220,hy mei wer meidwaan nei't er der in skoftke útstjoerd wie
common_voice_fy-NL_20760182.wav,191276,de klean moatte makke wêze fan stof dy't net krimpt
common_voice_fy-NL_20760211.wav,130604,hy freget nei de bekende wei
common_voice_fy-NL_20760287.wav,178988,ik sil de kommende wiken perfoarst rêst nimme moatte
common_voice_fy-NL_20760255.wav,205868,de polysje hat woansdeitemoarn trije fiskstreupers oanholden
common_voice_fy-NL_20760234.wav,109100,dat hear ik graach
common_voice_fy-NL_20760274.wav,172076,dêr binne dizze grutte wetterplassen fan oerbleaun
common_voice_fy-NL_20760286.wav,172076,sa binne we hjir telâne kaam en ik fûn it prachtich
common_voice_fy-NL_20760270.wav,215084,hy hâldt it kommende jier op woansdei sprekoere
common_voice_fy-NL_20760273.wav,180524,sy hat har nocht fan him hoe dan ek
common_voice_fy-NL_20760233.wav,182828,tsjintwurdich soe dat perfoarst net meie mar doe koe dat noch wol
common_voice_fy-NL_20760259.wav,154412,ik bin gjin bern mear
common_voice_fy-NL_20760288.wav,171308,ik drukte it ear tsjin it hout en harke
common_voice_fy-NL_20760297.wav,238892,troch dizze behanneling kin de kwaliteit fan libben fan de pasjinten ferbetterje
common_voice_fy-NL_20760296.wav,233516,der waard moandei mei de hurde wyn folop kitesurfd op de iselmar
common_voice_fy-NL_20760298.wav,126764,hja moat it no allinnich dwaan
common_voice_fy-NL_20760318.wav,118316,dêr bin ik bliid om hear
common_voice_fy-NL_21415783.wav,92204,zoom yn
common_voice_fy-NL_20760181.wav,135212,dêrnei hie er gjin jild mear
common_voice_fy-NL_20760335.wav,166700,meitsje mar in ôfspraak foar oare wike tongersdei
common_voice_fy-NL_20760367.wav,197420,de betide ierappels binne fan heal maaie ôf te krijen
common_voice_fy-NL_20760299.wav,173612,kommende wike is der in petear mei de wykagint
common_voice_fy-NL_20760319.wav,188204,hja holden de mûtse op en de moffen en jas oan
common_voice_fy-NL_20760317.wav,134444,noch altyd preket er sneins
common_voice_fy-NL_20760337.wav,156716,kondolearre mei it ferstjerren fan dyn muoike
common_voice_fy-NL_20760339.wav,193580,de europeeske lânbouministers komme freed gear yn brussel
common_voice_fy-NL_20760365.wav,113708,opnij skilje
common_voice_fy-NL_20760316.wav,195884,it is gesellich om mei inoar in miel klear te meitsjen
common_voice_fy-NL_20760295.wav,235052,om dat allegearre op te skriuwen dêr is gjin begjinnensein oan
common_voice_fy-NL_20760444.wav,152876,us mem fûn dy namme no just net botte moai
common_voice_fy-NL_20760401.wav,215852,pas ast sels oan 'e trapeze hongen hast witst hoe dreech soks is
common_voice_fy-NL_20760366.wav,162092,nei hûndert meter geane jo linksôf
common_voice_fy-NL_20760368.wav,237356,de húshâlding hie twa auto's ien dêrfan waard brûkt foar boadskipjen
common_voice_fy-NL_20760289.wav,151340,dat is fiif persint minder as ferline wike
common_voice_fy-NL_20760341.wav,125228,ik jou no sneon in feestje
common_voice_fy-NL_20760440.wav,149804,wêr komme jo wei as ik freegje mei
common_voice_fy-NL_20760402.wav,198956,hy hat har in treflik stik stjoerd oer it wurk dat er dien hat
common_voice_fy-NL_20760466.wav,135980,dat wie doe even wrâldnijs
common_voice_fy-NL_20760503.wav,228908,de twa holden har dwaande mei it yllegaal ferkrijen fan hypoteken
common_voice_fy-NL_20760442.wav,182060,wat in moai plakje dêr kinne wy de tinte wol delsette
common_voice_fy-NL_20760271.wav,192044,yn 'e wintermoannen hawwe wy de koartste dagen en de langste nachten
common_voice_fy-NL_20760369.wav,178220,heit en mem steane op har âlde dei yn 'e kjeld
common_voice_fy-NL_20760465.wav,195116,do moatst my net sa jachtsje we hawwe it rûm oan tiid
common_voice_fy-NL_20760468.wav,237356,underwiis hat der altyd west mar iuwenlang wie it net by de wet regele
common_voice_fy-NL_20760501.wav,185132,dat is funest foar de bewurking fan it lân
common_voice_fy-NL_20760469.wav,205100,de fraachprizen rinne op oant de fjouwer ton foar in bungalow
common_voice_fy-NL_20760443.wav,165932,ik jou op sneon sân maaie in feest
common_voice_fy-NL_20760470.wav,238124,mei dy saterdeisklup promovearre er it ôfrûne seizoen nei de twadde klassse
common_voice_fy-NL_20760315.wav,130604,wat kostet in inkelde reis
common_voice_fy-NL_20760257.wav,220460,de frou rôp dat de polysje belle wie en dêrop naaiden de dieders út
common_voice_fy-NL_20760525.wav,113708,hoe let hawwe jim skoft
common_voice_fy-NL_20760336.wav,210476,bern hawwe altyd dokterkeboarte en sille dat altyd dwaan
common_voice_fy-NL_20760400.wav,206636,do moatst dy no ynsmarre oars bist aanst sa read as in byt
common_voice_fy-NL_20760522.wav,170540,hy hat der nei frege mar kriget hjir gjin antwurd op
common_voice_fy-NL_20760523.wav,112172,spylje dat ôf
common_voice_fy-NL_20760550.wav,206636,de ôfrûne tiid hat de nije foarsitter geregeld ôfwêzich west
common_voice_fy-NL_20760547.wav,148268,wy ride mei de auto nei de top fan de berch
common_voice_fy-NL_20760504.wav,153644,sjoch dêr stean de pakjes
common_voice_fy-NL_20760548.wav,241964,dit produkt is in solide basis dêr't in tanimmende fraach nei is
common_voice_fy-NL_20760546.wav,240428,de dieders ferdwûnen hastich yn it neat en binne noch hieltyd spoarleas
common_voice_fy-NL_20760180.wav,241196,men moat dus earne in grins stelle hjir oan ta en net fierder
common_voice_fy-NL_20760505.wav,205868,it is in fanselssprekkende saak dat der wetter út de kraan komt
common_voice_fy-NL_20471579.wav,241964,de ûntdekking fan it skaaltsje soarge foar in soad reaksjes
common_voice_fy-NL_20760524.wav,139820,syn hoanne moat altyd koaning kraaie
common_voice_fy-NL_20760549.wav,106028,foarige
common_voice_fy-NL_20788592.wav,211244,de wedstriidkommissaris makke bekend dat de wedstriid útsteld wie fanwege driigjend swier waar
common_voice_fy-NL_20760521.wav,198188,op tiisdeitemoarn besoargje se iten by partikulieren oan hús
common_voice_fy-NL_20760403.wav,222764,syn freondinne is in pear minuten lyn mei slaande doarren ôfset
common_voice_fy-NL_20788590.wav,174380,yn syn kwekerij hat er in kolleksje planten dy't konstant feroaret
common_voice_fy-NL_20788593.wav,144428,hy wurdt in soad frege mar hy seit net op alles ja
common_voice_fy-NL_20471576.wav,134444,skriuw dat as nûmer
common_voice_fy-NL_20788597.wav,157484,de sneldyk is no sneontenacht ticht troch wurksumheden
common_voice_fy-NL_20471578.wav,217388,saterdeitejûns hiene we faak ien of oar feestje of iterijke mei kollega's
common_voice_fy-NL_20760214.wav,110636,lampe yn 'e hoeke út
common_voice_fy-NL_20788596.wav,124460,der komt altyd wolris in kink yn 't tou
common_voice_fy-NL_20788591.wav,142892,stel dizze sel yn op breuken fan achtsten
common_voice_fy-NL_20788613.wav,212012,de plysje sil aktyf by ûndernimmers del om har te warskôgjen foar ynbraken
common_voice_fy-NL_20788610.wav,119852,jimme hawwe jimme hiele libben noch foar jimme
common_voice_fy-NL_20471580.wav,124460,ja ik bin anneke
common_voice_fy-NL_20760502.wav,219692,bûten esperanto sprekt er fansels ek oare frjemde talen
common_voice_fy-NL_20788621.wav,115244,dat hat neat mei my te krijen
common_voice_fy-NL_20471577.wav,216620,de bedriuwsmakelder wurdt net senuweftich fan de tanimmende leechstân
common_voice_fy-NL_20788646.wav,147500,it iepenbier ministearje fûn de straf te licht en tekene berop oan
common_voice_fy-NL_20788622.wav,93740,dat kin my neat skele
common_voice_fy-NL_20788630.wav,90668,dat woe ik noch wolris begripe
common_voice_fy-NL_20788648.wav,159788,de saterdeitemoarns nei keningsdei bellet syn mem him wekker
common_voice_fy-NL_20788629.wav,92204,untskoattelje dizze sel
common_voice_fy-NL_20788631.wav,119084,de stimming wie wat tryst en hingerich
common_voice_fy-NL_20788620.wav,130604,de útspraak is no krekt bekend wurden
common_voice_fy-NL_20788612.wav,175916,letter op dizze dei soene alle famyljes byinoar komme om kalkoen te iten
common_voice_fy-NL_20788647.wav,161324,heel stadich begjint de prins in lyts bytsje oan te sterkjen
common_voice_fy-NL_20900727.wav,146732,it wie de earste kear dat ik him sa neamde
common_voice_fy-NL_20760441.wav,116780,ik soe dat net samar leauwe
common_voice_fy-NL_20948363.wav,165164,in feedokter is ferstoarn troch besmetting mei de fûgelgryp
common_voice_fy-NL_20788609.wav,162092,ien gek freget mear as sân wizen beäntwurdzje kinne
common_voice_fy-NL_20948366.wav,147500,it ryk hat in soad besunige op de húshâldlike help
common_voice_fy-NL_20948364.wav,122924,hy wachte oant it fjoer oplôge
common_voice_fy-NL_20948362.wav,174380,dus sil ik it him ris freegje
common_voice_fy-NL_20948368.wav,187436,der is wjerstân tsjin it foarnimmen om wynmûnen yn de iselmar te pleatsen
common_voice_fy-NL_20900725.wav,143660,dizze bewâldsman regearret mei izeren hân
common_voice_fy-NL_20788644.wav,123692,oft dat al op koarte termyn slagget is net te sizzen
common_voice_fy-NL_20958302.wav,154412,de kuierders en fytsers genietsje fan de unike lânskippen
common_voice_fy-NL_20788611.wav,125996,ik woe graach in merje keapje
common_voice_fy-NL_20958299.wav,112172,nearne hat er mear tiid foar
common_voice_fy-NL_20948369.wav,176684,mei de wiisfinger treau er it montuer werom op syn plak
common_voice_fy-NL_20971684.wav,159788,de earste wrâldoarloch betsjut in protte wurkleazens
common_voice_fy-NL_20900726.wav,164396,as hja fuort wie paste ik op it hûs en op 'e hûn
common_voice_fy-NL_20788623.wav,107564,ik hâld net fan dûnsjen
common_voice_fy-NL_20948371.wav,152876,de rûmten binne sa feilich en noflik mooglik makke
common_voice_fy-NL_20948370.wav,90668,it wie swart en glibberich
common_voice_fy-NL_20900728.wav,121388,dizze ôfspraak trochstjoere
common_voice_fy-NL_20971687.wav,112172,wy moatte de koppen telle
common_voice_fy-NL_20992220.wav,172844,hy lei it boek neist him op de bank en kaam oerein
common_voice_fy-NL_20992316.wav,156716,de bagaazje waard opslein yn in rûmte oan de ezingewei
common_voice_fy-NL_20958301.wav,182060,de taksysjauffeur nimt it iikhoarntsje dat er rêden hat oeral mei hinne
common_voice_fy-NL_20992226.wav,124460,hy seach mei bange eagen nei har
common_voice_fy-NL_20971683.wav,92972,tankjewol
common_voice_fy-NL_20992315.wav,95276,dêr mei ik wol oer
common_voice_fy-NL_20948367.wav,160556,sokke leararen hawwe wy tige slim ferlet fan
common_voice_fy-NL_20992222.wav,120620,hoe steane de beurzen derfoar
common_voice_fy-NL_21017871.wav,194348,tsjin my sei hja dat hja wurch wie en it yn de rêch hie
common_voice_fy-NL_20788633.wav,165932,it bliuwt noch altyd dreech om erkenning te krijen foar it famkesfuotbal
common_voice_fy-NL_20992227.wav,99116,o dat kin my neat skele
common_voice_fy-NL_21017873.wav,125228,ik ha it thús wol nei it sin
common_voice_fy-NL_20992314.wav,172844,yn de rin fan it jier wurde in stik of wat keuringen holden
common_voice_fy-NL_21225587.wav,165164,dit is it lûd fan in pompke
common_voice_fy-NL_20971686.wav,132140,syn frou en hy wenje dêr mei in soad nocht
common_voice_fy-NL_21225600.wav,99884,it brocht him yn ferlegenheid
common_voice_fy-NL_20992313.wav,181292,as je de oare kant útsjogge dan sjogge je oer de greiden hinne
common_voice_fy-NL_21017876.wav,118316,komt it no omdat jim sa sterk binne
common_voice_fy-NL_21225599.wav,216620,hy wennet tusken eastermar en harkema dus heech en drûch op de sângrûn
common_voice_fy-NL_21225597.wav,178988,it lytse ploechje yntern ferdielde aktivisten koe neat klear krije
common_voice_fy-NL_21225623.wav,110636,men hat der soms gjin ferstân fan
common_voice_fy-NL_21225590.wav,122156,doe ha se noch fiif bern krigen
common_voice_fy-NL_21225626.wav,102956,it hinget my ta de strôt út
common_voice_fy-NL_21225647.wav,115244,se hawwe it skiep werombrocht nei it lân
common_voice_fy-NL_21225622.wav,106796,hoe let wie dat
common_voice_fy-NL_20788243.wav,115244,wat haw ik nedich foar it resept
common_voice_fy-NL_21225643.wav,112940,betink by dysels dat der moarn wer in dei is
common_voice_fy-NL_20788242.wav,217388,yn 'e betide nacht fan saterdei op snein moast de plysje yngripe by fjochterij
common_voice_fy-NL_21225589.wav,113708,oan jo om wat te sizzen
common_voice_fy-NL_21225645.wav,111404,dy begelieden de sang by de mis
common_voice_fy-NL_21017874.wav,151340,de moandeis kaam dan lang om let de sinne dertroch
common_voice_fy-NL_21225625.wav,132908,sina is ryk oan natuerlike grûnstoffen
common_voice_fy-NL_21225591.wav,157484,hy sil wol troud wêze fansels en hawwe se ek bern
common_voice_fy-NL_21225588.wav,208172,natuerliker buorkjen moat in grutter ferskaat oan planten bisten en fûgels opsmite
common_voice_fy-NL_20788272.wav,148268,nee dizze diken binne neat wurdich
common_voice_fy-NL_20788253.wav,182828,fóár it ferplantsjen wurdt de grûn goed losmakke
common_voice_fy-NL_21225601.wav,118316,is dat net wat in falske romantyk
common_voice_fy-NL_21226541.wav,105260,wêr ha ik dy earder sjoen
common_voice_fy-NL_21226540.wav,170540,minsken sjogge net nei de kwaliteit fan in skilderij mar nei de namme
common_voice_fy-NL_20788240.wav,126764,it is ek foardeliger foar jo
common_voice_fy-NL_20788250.wav,217388,ik ha thús by ús heit yn de reedfabryk wurke jierrenlang redens makke
common_voice_fy-NL_20992224.wav,155948,ik bin bliid dat de oannimmer mei dizze oplossing oansetten kaam
common_voice_fy-NL_21225624.wav,142124,wy hawwe noch noait ien foar in tichte doar stean litten
common_voice_fy-NL_20788239.wav,98348,binne jimme famylje
common_voice_fy-NL_20788241.wav,240428,foar operative yngrepen oan de bynier is de algemien sjirurch de oanwiisde figuer
common_voice_fy-NL_21225638.wav,181292,ik ha mei him praat oer de besteande sitewaasje oangeande ús flat
common_voice_fy-NL_20788264.wav,109868,stavering kontrolearje
common_voice_fy-NL_20788262.wav,134444,blêdzje troch lietsje
common_voice_fy-NL_20788257.wav,144428,dy slimme som haw ik twa oeren op sitten
common_voice_fy-NL_20788263.wav,230444,de itensbanken wurkje manmachtich om minsken alle dagen wer fan iten te foarsjen
