wav_filename,wav_filesize,transcript
common_voice_fy-NL_20817339.wav,159788,hy hat in bysûnder plak ynnommen yn fryslân
common_voice_fy-NL_20817306.wav,119084,it jild glydt ús troch de fingers
common_voice_fy-NL_20817323.wav,163628,de brân ûntstie fan 'e middei om tsien oer ienen hinne
common_voice_fy-NL_20817256.wav,169004,de grûn wurdt alhiel trochweakke mei al dat reinwetter
common_voice_fy-NL_20861207.wav,172844,in protte minsken witte datst ûngenêslik siik bist
common_voice_fy-NL_20861206.wav,155948,op it fean ha we hjir no in keunstiisbaan
common_voice_fy-NL_20861209.wav,172844,wy binne bliid mei ekstra nachtwachten en ekstra help oan board
common_voice_fy-NL_20817361.wav,184364,allinnich ús mem haw ik noch nea rûzje meitsjen heard
common_voice_fy-NL_20861208.wav,106028,dêr hâldt de wrâld op
common_voice_fy-NL_20817332.wav,140588,belje wytse hoekstra fia facetime
common_voice_fy-NL_20817351.wav,213548,in deiboekskriuwer dêr't men út en troch gjin argewaasje fan hat doocht net
common_voice_fy-NL_20861252.wav,149804,it is in handich apparaat dat ús wurk út hannen nimt
common_voice_fy-NL_20817359.wav,165164,wat sette him oan ta it kiezen fan it fak fan dûmny
common_voice_fy-NL_20861250.wav,188204,ik bin gjin master yn it oanknoopjen fan kontakten mei folslein frjemden
common_voice_fy-NL_20861223.wav,194348,de jongste dochter easket in grêfferbod foar de fertochte
common_voice_fy-NL_20867717.wav,188204,earlik is earlik se wienen alle fiif o sa bysûnder
common_voice_fy-NL_20867705.wav,149804,it waar wie sa min as strie
common_voice_fy-NL_20867720.wav,138284,it doarp is stil en ferlitten
common_voice_fy-NL_20861232.wav,165164,de swier ferwûne bestjoerder is oerbrocht nei it grinzer sikehús
common_voice_fy-NL_20861254.wav,159788,de gemeente wol earst om tafel mei de omwenners
common_voice_fy-NL_20817299.wav,221228,tomaat auberzjine en paprika komme fan planten fan de ierappelfamylje
common_voice_fy-NL_20817336.wav,126764,ik begjin in bytsje slûch te wurden
common_voice_fy-NL_20867703.wav,153644,al myn freonen en famylje binne dea
common_voice_fy-NL_20867740.wav,182828,foar it lytsfamke is it hearlik om yn har eigen tún boartsje te kinnen
common_voice_fy-NL_20867734.wav,129068,hy kin altyd omdraaie en weromgean
common_voice_fy-NL_20817343.wav,138284,elk moat syn eigen strjitsje mar skjinhâlde
common_voice_fy-NL_20867738.wav,192044,it boek giet oer it famke jasmyn dy't in echte deidreamer is
common_voice_fy-NL_20867721.wav,205868,ik winskje jimme in moai ferbliuw yn yndia ta en in feilige reis
common_voice_fy-NL_20867757.wav,211244,wy knipperje middeis hiel even want de jetlag slacht sonder genede ta
common_voice_fy-NL_20867702.wav,159788,jo moatte ien freegje dy't dêr ferstân fan hat
common_voice_fy-NL_20861224.wav,161324,jimme binne no al sa grut jimme kinne jim no wol rêde
common_voice_fy-NL_20861234.wav,172844,no't ik de foto's sjoen ha bin ik dochs wol wat kjel wurden
common_voice_fy-NL_20867759.wav,138284,de donkerblauwe baret wurdt brûkt troch de mariniers
common_voice_fy-NL_20867758.wav,257324,dizze byfangst wurdt oan board útsocht en wer yn it wetter smiten
common_voice_fy-NL_20867737.wav,111404,wy soenen graach wat ite wolle
common_voice_fy-NL_20817344.wav,144428,dat is allegear ferfallen dat is net mear yn gebrûk
common_voice_fy-NL_20861221.wav,190508,de kâns op in blessuere mei gjin reden wêze om net te sporten
common_voice_fy-NL_20861233.wav,209708,hy hat my doe de funksje oanbean fan sjef redakteur fan de útjouwerij
common_voice_fy-NL_20907865.wav,142124,alles wat mem seit is hielendal wier
common_voice_fy-NL_20755601.wav,167468,it hat my in protte tiid koste om it te skriuwen
common_voice_fy-NL_20867761.wav,130604,der is in tiid fan kommen en in tiid fan gean
common_voice_fy-NL_20755586.wav,150572,meitsje in ôfspraak mei piet en anke de boer
common_voice_fy-NL_20755584.wav,176684,ottermantsjes meitsje hiel wat kilometers op siik nei wyfkes
common_voice_fy-NL_20755587.wav,178988,it sprekoere dat alle tongersdeitemiddeis holden wurdt is altyd folboekt
common_voice_fy-NL_20755589.wav,102188,is de doar op slot
common_voice_fy-NL_20867706.wav,198188,dy tiisdeitemiddeis koe der gjin middeisiten optsjinne wurde
common_voice_fy-NL_20755591.wav,112940,selektearje de rigel
common_voice_fy-NL_20907864.wav,172844,wêr wurde de kosten fan it ûndersyk út betelle
common_voice_fy-NL_20755590.wav,212012,ein febrewaarje komme de earste bewenners en sille se ek begjinne mei deisoarch
common_voice_fy-NL_20867760.wav,117548,it hie yn wiken al net reind
common_voice_fy-NL_20755585.wav,221996,it gemiddelde ynkommen is op skylge op flylân nei it heechste yn nederlân
common_voice_fy-NL_20755599.wav,135980,ik haw alles al ris in kear meimakke
common_voice_fy-NL_20755588.wav,168236,hy kearde syn fyts om en trape grimmitich nei den haach werom
common_voice_fy-NL_20907867.wav,241964,fjurwurkbrillen moatte foarkomme dat minsken eachletsel oprinne troch fjurwurk
common_voice_fy-NL_20907866.wav,198188,jild makket alle doarren iepen mar de himelpoarte net
common_voice_fy-NL_20755606.wav,124460,fansels wat kin ik foar dy dwaan
common_voice_fy-NL_20867733.wav,159788,de waskmasine dêr komt gjin kalkoanslach mear yn
common_voice_fy-NL_20755602.wav,196652,de wylde bijen binne yn dizze perioade al wakker op 'e syk nei huning
common_voice_fy-NL_20755600.wav,171308,ik ha altyd myn wurk sintraal steld boppe de húshâlding
common_voice_fy-NL_20755605.wav,228140,fierwei de measte lietteksten geane oer de leafde en relaasjes
common_voice_fy-NL_20907863.wav,148268,se is dêrby berekkenjend te wurk gien
common_voice_fy-NL_20755604.wav,183596,ien tredde fan de befolking is fan hûs en hear ferdreaun
common_voice_fy-NL_20755609.wav,124460,dêr stienen him de hannen net nei
common_voice_fy-NL_20755613.wav,147500,hoe't it mei barend gongen is dat wit ik fierder net
common_voice_fy-NL_20755620.wav,121388,we ha in protte leard tink ik
common_voice_fy-NL_20755611.wav,151340,ik sjoch gjin inkelde reden om op te hâlden
common_voice_fy-NL_20755603.wav,112172,hoefolle leden ha jim no
common_voice_fy-NL_20867704.wav,167468,it programmaboekje fan de skouboarch is wer ferskynd
common_voice_fy-NL_20755607.wav,134444,belje linda hamersma
common_voice_fy-NL_20861231.wav,99884,hoe let is it yn londen
common_voice_fy-NL_20755612.wav,134444,we moatte der mar in mouwe oan passe
common_voice_fy-NL_20755610.wav,165164,dêrwei hast in moai útsjoch oer de âlde stêd en de see
common_voice_fy-NL_20867718.wav,202028,by need kin in part fan de alvestêdetocht op skeelers ôflein wurde
common_voice_fy-NL_20755608.wav,170540,de tinte en de dingen dy't se brûke moatte lizze wer op de karre
common_voice_fy-NL_20755621.wav,195884,doe't ik thús bêdlegerich wie stie er nachts en deis foar my klear
common_voice_fy-NL_20755592.wav,123692,yt klaas wolris spagetty
common_voice_fy-NL_20755630.wav,185132,om tolve oere giet de disko iepen dêr giet elkenien hinne
common_voice_fy-NL_20755622.wav,196652,se skrillen der úteinlik foar tebek omdat se it risiko te grut fûnen
common_voice_fy-NL_20755632.wav,143660,guon doarpen lizze oan de ein fan de wrâld
common_voice_fy-NL_20755629.wav,157484,de donkere moannen binne lang om let foarby
common_voice_fy-NL_20755623.wav,199724,foar elk gefal kostet it ûndersyk likernôch tritichtûzen euro
common_voice_fy-NL_20755661.wav,159020,har gesicht luts wyt wei as seach se in spûk
common_voice_fy-NL_20755650.wav,103724,ik fiel my net âld
common_voice_fy-NL_20755651.wav,135980,de bûtenste muorren binne nachtblau
common_voice_fy-NL_20755633.wav,222764,de boarringen soene ek grutte gefolgen ha foar de âlde gebouwen yn de stêd
common_voice_fy-NL_20755669.wav,172844,fan dat momint ôf wiene wy it bestjoer fan de harmony
common_voice_fy-NL_20755652.wav,113708,dat kinst net meitsje
common_voice_fy-NL_20755662.wav,133676,ik hearde dat se binnendoar omskarrele
common_voice_fy-NL_20755670.wav,109100,hoelang moat ik dêroan wurkje
common_voice_fy-NL_20755649.wav,154412,dat is suver wol wis dat dat sa is
common_voice_fy-NL_20755660.wav,167468,har galery is iepen op freedtejûn en saterdei
common_voice_fy-NL_20755659.wav,142892,dat koenen dy feansters fansels ek net helpe
common_voice_fy-NL_20755674.wav,155948,dy iisbaan koe moai yn de fryslânhal
common_voice_fy-NL_20755663.wav,158252,do kinst it net hawwe dat heit en mem mear fan my hâlde
common_voice_fy-NL_20755676.wav,160556,hy joech opdracht om it hiele bedrach werom te stoarten
common_voice_fy-NL_20755631.wav,158252,ik bin hjir wol tefreden oer
common_voice_fy-NL_20755710.wav,169004,wy hawwe echt it idee dat wy in gat yn 'e merk fûn hawwe
common_voice_fy-NL_20755671.wav,248876,bern dy't boarten mei fjurwurk hawwe tiisdeitemoarn brân feroarsake yn in hûs
common_voice_fy-NL_20867719.wav,171308,ik hearde yn 'e moarnsstilte in yslike gjalp
common_voice_fy-NL_20755694.wav,134444,ik bin it absolút net mei jo iens
common_voice_fy-NL_20861251.wav,165164,de brânwacht moast de ferwûne man út de auto snije
common_voice_fy-NL_20755677.wav,199724,ik fyn it prachtich at der hele moaie grutte beammen steane
common_voice_fy-NL_20755675.wav,218924,hy sil betelje yn trije terminen no net en dan net en noait net
common_voice_fy-NL_20755678.wav,204332,hy hat goede hope dat der noch jild foar it goede doel oerbliuwe sil
common_voice_fy-NL_20755686.wav,129068,sa'n man dêr hat men wat oan
common_voice_fy-NL_20755701.wav,167468,ik ha om njoggen oere in ôfspraak mei de fysioterapeut
common_voice_fy-NL_20755699.wav,189740,it gegûl fan de seekobben en strânljippen hearde er net
common_voice_fy-NL_20755702.wav,183596,we sitte hjir no yn de kânselarij tsjinoer it frysk museum
common_voice_fy-NL_20755653.wav,192812,minsken út heel fryslân wei kamen tolve wiken lang nei ljouwert
common_voice_fy-NL_20755695.wav,139052,wannear libbe gysbert japiks
common_voice_fy-NL_20755688.wav,141356,hy wie in meiwurker fan it earste begjin
common_voice_fy-NL_20755696.wav,222764,de artikels dy't jo omruilje wolle kinne jo weromstjoere nei it retoeradres
common_voice_fy-NL_20755703.wav,208172,ynspeksjebesites oan ferpleechhûzen moatte net mear oankundige wurde
common_voice_fy-NL_20755619.wav,189740,it waard him dúdlik dat it feest oan in soad regels foldwaan moast
common_voice_fy-NL_20755672.wav,109868,klik bewarje
common_voice_fy-NL_20755687.wav,194348,in kroan of in brêge wurdt yn in tosktechnysk laboratoarium makke
common_voice_fy-NL_20755700.wav,158252,david seit dat er syn hannen fan har ôflûkt
common_voice_fy-NL_20755730.wav,172844,ik wol net de kâns rinne dat ik har mem oan 'e line krij
common_voice_fy-NL_20755731.wav,143660,it hat diskear wol in heel skoft duorre
common_voice_fy-NL_20755593.wav,131372,ik wit net hoe't ik hjir mei oan moat
common_voice_fy-NL_20755684.wav,153644,hy hat in pittich temperamint en in hurde kop
common_voice_fy-NL_20755685.wav,185900,hy hat him yn in hotelkeamer mei slieppillen it libben benommen
common_voice_fy-NL_20755724.wav,185132,de soarchgroep is fan plan om trije fersoargingshuzen te sluten
common_voice_fy-NL_20755709.wav,135980,moarn wurdt de waarmste dei fan 'e wike
common_voice_fy-NL_20755725.wav,178988,dejinge dy't him derta roppen fielt moat him mar oppenearje
common_voice_fy-NL_20755718.wav,143660,sy wol gjin kwea wurd hearre oer har famylje
common_voice_fy-NL_20755673.wav,124460,hawwe jo de dief sjoen
common_voice_fy-NL_20755729.wav,228140,de organisaasje organisearret alle jierren in stik as wat moetings fan frijwilligers
common_voice_fy-NL_20755732.wav,196652,de resultaten falle tsjin en it bedriuw moat in skuld ôflosse
common_voice_fy-NL_20755726.wav,126764,sa'n ding is net makke foar de ivichheid
common_voice_fy-NL_20755712.wav,109868,dat is alles wat ik fan him wit
common_voice_fy-NL_20755746.wav,151340,de nijelingen lieten har fan de goede kant sjen
common_voice_fy-NL_20755744.wav,170540,ik ergerje my oan in hiel soad dingen
common_voice_fy-NL_20755733.wav,187436,lege skuon stypje de ankels minder as hege
common_voice_fy-NL_20755758.wav,231980,sy heart by de inisjatyfnimmers fan in hantekeninge aksje dy't oan de gong is
common_voice_fy-NL_20755757.wav,124460,selektearje de folgjende
common_voice_fy-NL_20755754.wav,208172,der moat jild ynvestearre wurde yn saken as wurkgelegenheid en natuer
common_voice_fy-NL_20755755.wav,208172,neffens it aksjekomitee nimt de boargemaster de ynwenners net serieus
common_voice_fy-NL_20755711.wav,156716,ienris wie se it moaiste famke fan 'e klasse
common_voice_fy-NL_20755766.wav,175916,yn 'e nacht fan saterdei op snein is der in grut nachtfeest
common_voice_fy-NL_20755764.wav,193580,wy kinne net oant yn de ivichheid dwaan as blet ús de noas
common_voice_fy-NL_20755765.wav,230444,se learde steno en typen en waard sekretaresse by in kollega fan ús omke
common_voice_fy-NL_20755783.wav,126764,ik moast it heft yn eigen hannen nimme
common_voice_fy-NL_20755748.wav,158252,de brommer waard werombrocht by de rjochtmjittige eigener
common_voice_fy-NL_20755716.wav,131372,klik persoanlike opdrachten
common_voice_fy-NL_20755774.wav,154412,hy hat de wyn der goed ûnder yn syn bedriuw
common_voice_fy-NL_20755756.wav,135980,ik bliuw dit jier yn fryslân
common_voice_fy-NL_20755745.wav,205100,de boargemaster docht in oprop om net sa gau lilk te wurden
common_voice_fy-NL_20755747.wav,162860,hy hat wurke oan it oersetten fan de bibel yn it frysk
common_voice_fy-NL_20755775.wav,215852,hy sil betelje yn trije terminen no net en dan net en nea net
common_voice_fy-NL_20755779.wav,191276,ik gean in pear oeren nei it museum en bin tsjin tolven wer werom
common_voice_fy-NL_20755772.wav,142892,hy is yn it wetter fallen en koe der net mear út komme
common_voice_fy-NL_20755727.wav,215084,mocht in ynbrekker deryn komme dan is it hûs noch útrêste mei bewegingsmelders
common_voice_fy-NL_20755771.wav,149036,de pomp op de buorkerij is al tsien jier yn gebrûk
common_voice_fy-NL_20755782.wav,157484,alles rûn yn it hûndert en in soad seagen it net mear sitten
common_voice_fy-NL_20755781.wav,182828,moarns wie it blau fan 'e loft sa tin dat it hast wyt wie
common_voice_fy-NL_20854455.wav,159788,de kosten fan de operaasje wurde rûsd op sa'n twa ton
common_voice_fy-NL_20755717.wav,158252,ik lies yn 'e krânte dat er arrestearre wie
common_voice_fy-NL_20854525.wav,111404,ik hie in ljipaai fûn
common_voice_fy-NL_20854456.wav,129068,hy fielde hoe't er read om 'e holle waard
common_voice_fy-NL_20755767.wav,153644,it is allegearrre yn hannen fan ús abbekaat
common_voice_fy-NL_20755769.wav,198188,der wurde gjin útstjoerkrêften mear ynhierd en tydlike kontrakten wurde net ferlinge
common_voice_fy-NL_20755768.wav,114476,soe ik jo helpe kinne
common_voice_fy-NL_20755780.wav,143660,meitsje 'grut feest' kursyf
common_voice_fy-NL_20854546.wav,208940,it ferbrûk nachts heart gâns leger te wêze as it ferbrûk deis
common_voice_fy-NL_20854547.wav,157484,ast der oars oer tinkste moatst wol mei grûnen komme
common_voice_fy-NL_20755773.wav,139052,ik wit net wêr't er de moed wei helle hat
common_voice_fy-NL_20755770.wav,151340,wy koene der net goed ûnder bliuwe wy moasten laitsje
common_voice_fy-NL_20854563.wav,129068,der is gjin minder wurk as neatdwaan
common_voice_fy-NL_20854521.wav,150572,plannen ferskine en ferdwine mei de faasje fan it ljocht
common_voice_fy-NL_20854562.wav,112172,meitsje de foarige rige sichtber
common_voice_fy-NL_20854561.wav,122924,do hellest my de wurden út de mûle
common_voice_fy-NL_20854458.wav,143660,in bern fielt him dêr sels faak hiel skuldich ûnder
common_voice_fy-NL_20755714.wav,192044,der brekt in tûke der falt in beam mar ik rin gjin gefaar
common_voice_fy-NL_20854523.wav,201260,der binne fjouwer wynstreken en fjouwer seizoenen en fjouwer evangelisten
common_voice_fy-NL_20854454.wav,152108,foar de bingo hoechst dy net op te jaan
common_voice_fy-NL_20854548.wav,156716,earder naam chris saterdeis blommen foar har mei
common_voice_fy-NL_20854560.wav,125996,neffens har kin it sa ek wol
common_voice_fy-NL_20854549.wav,155948,de earste kear frege ik my wol ôf wat it wêze soe
common_voice_fy-NL_20854550.wav,179756,noch foardat wy it iten ophiene hong er al oan de telefoan
common_voice_fy-NL_20854568.wav,145196,wy hawwe noch nea ien foar in tichte doar stean litten
common_voice_fy-NL_20889728.wav,165164,hy draacht in kûgelfrij fest en seit dat er fan de oardertsjinst is
common_voice_fy-NL_20889730.wav,160556,mei in pear yngrepen is soks bêst te ferhelpen
common_voice_fy-NL_20854566.wav,112940,alle sûker is op de grûn fallen
common_voice_fy-NL_20889729.wav,99116,neffens my hat er gelyk
common_voice_fy-NL_20755728.wav,117548,sa hear ik it graach
common_voice_fy-NL_20755776.wav,165164,hy skoot it skriuwen fan syn skripsje op 'e lange baan
common_voice_fy-NL_20854567.wav,157484,men leart om jin as ûntwerper dúdlik te profilearjen
common_voice_fy-NL_20854570.wav,113708,iepenje whatsapp
common_voice_fy-NL_20854569.wav,185132,hy wie ûnderwizer en letter direkteur fan de kweekskoalle yn snits
common_voice_fy-NL_20889727.wav,89900,piter hearde raar op
common_voice_fy-NL_20889745.wav,153644,ast no alfêst de boel oan 'e kant makkest bist der moarn fan ôf
common_voice_fy-NL_20889746.wav,145964,der hongen doeken fan masters út eardere iuwen
common_voice_fy-NL_20755778.wav,162860,as jo my net holpen hienen wie ik net slagge
common_voice_fy-NL_20889758.wav,192812,yn febrewaarje is de oprjochting fan dy partij ek yn fryslân al wiidweidich betocht
common_voice_fy-NL_20889731.wav,185132,buertbewenners hearden rûzje en in lûde knal en se warskôgen de polysje
common_voice_fy-NL_20889759.wav,148268,meitsje it folk benaud dan sil it wol efter dy oan rinne
common_voice_fy-NL_20889744.wav,128300,album fan gurbe douwstra ôfdraaie
common_voice_fy-NL_20889775.wav,137516,set it folume op fyftich persint
common_voice_fy-NL_20889780.wav,162092,ynset fan it debat is it iepenhâlden fan it sikehús
common_voice_fy-NL_20889771.wav,172076,asto no seist ik hâld fan dy dan sis ik dat ek tsjin dy
common_voice_fy-NL_20889773.wav,104492,ik gean leaver nei in museum
common_voice_fy-NL_20889769.wav,109868,meitsje dizze rige kursyf
common_voice_fy-NL_20889778.wav,116012,ik tocht dat er it wol begrepen hie
common_voice_fy-NL_21080934.wav,189740,wolle jo it artikel weromstjoere brûk dan it retoerformulier
common_voice_fy-NL_20889767.wav,132140,de skriuwer wurket foar omrop fryslân
common_voice_fy-NL_21080990.wav,109100,wat fine jo fan sa'n wedstriid
common_voice_fy-NL_21080932.wav,205100,yn de haadstêd hawwe hjoed fyftjin tafersjochhâlders op paad west
common_voice_fy-NL_21080935.wav,114476,it is net de muoite wurdich
common_voice_fy-NL_21081052.wav,116780,dy man sei dat dat net sa slim is
common_voice_fy-NL_21080933.wav,189740,it ferbân tusken har stoarnis en har dieden is ûndúdlik
common_voice_fy-NL_20889779.wav,119852,oan 'e muorre hinget in portret
common_voice_fy-NL_21081055.wav,169004,it begûn dermei dat ús mem by him oan it wurk gie
common_voice_fy-NL_20854457.wav,177452,de man is gjin bekende fan justysje seit in plysjewurdfierster
common_voice_fy-NL_21081051.wav,182060,hja hat jierren yn de bosk wenne no is hja werom yn amsterdam
common_voice_fy-NL_20889742.wav,155180,hja wie lykme allinnich dus moast hja harsels rêde
common_voice_fy-NL_21081046.wav,166700,hja die de moarnsjas út en stie efkes foar de spegel
common_voice_fy-NL_21080989.wav,178988,it joech skeane gesichten mar it is úteinlik rjochtbreide
common_voice_fy-NL_21081054.wav,142124,de hiele kommende wike is it stoarmich waar
common_voice_fy-NL_21080992.wav,165932,hy hie de foargeande nacht amper sliepe kinnen fan 'e opwining
common_voice_fy-NL_20889760.wav,151340,dat wie no in famke dat hjir hielendal net thúshearde
common_voice_fy-NL_21081050.wav,186668,der is in beam tsjin in hús oan fallen der binne gjin ferwûnen fallen
common_voice_fy-NL_20889761.wav,115244,wat is de luchtfochtichheid yn 'e kelder
common_voice_fy-NL_21081108.wav,98348,wat kinst winne
common_voice_fy-NL_20889743.wav,192044,al tweintich jier wachtsje ik op in echt geskikte en betelbere elektryske auto
common_voice_fy-NL_21081047.wav,216620,op koarte termyn wurde befolkingsfraachstikken as krimp en fergrizing hjir ek aktueel
common_voice_fy-NL_21081056.wav,161324,op 'e middei wurdt de winner bekend makke troch de sjuery
common_voice_fy-NL_21081048.wav,147500,wy hoopje dat de ferbouwing yn april klear wêze sil
common_voice_fy-NL_21081149.wav,137516,oan it getsjotter fan de famkes kaam gjin ein
common_voice_fy-NL_21081147.wav,172844,der siet in lek yn de haadwetterlieding foar de doar by de boekhannel
common_voice_fy-NL_21081105.wav,216620,by de kontrôle bliek dat de bestjoerder fan de auto gjin jildich rydbewiis hie
common_voice_fy-NL_21081145.wav,130604,hy sei dat ik te lyts wie foar in altfioele
common_voice_fy-NL_21081206.wav,205868,it eilân moat neffens ûndersikers al fan de iere midsiuwen ôf bewenne west hawwe
common_voice_fy-NL_21081205.wav,160556,hy stie mûsstil yn de keamer en harke nei it sykheljen fan syn frou
common_voice_fy-NL_21081109.wav,197420,de koarknapen stienen op de twadde ferdjipping en se hienen útsicht op it altaar
common_voice_fy-NL_21081150.wav,132908,de kursus bestiet út seis byienkomsten
common_voice_fy-NL_20889757.wav,202796,de software giet nei oft jo systeem foldocht oan de minimale systeemeasken
common_voice_fy-NL_21081106.wav,130604,hy wie tweintich minuten oer alven thús
common_voice_fy-NL_21081208.wav,110636,set de tillefyzje oan
common_voice_fy-NL_21081226.wav,173612,foar in deitocht is in lytse rêchsek fan sa'n tritich liter meastal genôch
common_voice_fy-NL_21081223.wav,154412,myn kollega en ik hawwe om 'e wike moandeis frij
common_voice_fy-NL_21080991.wav,121388,hy prate troch as hie er har net heard
common_voice_fy-NL_21081244.wav,149804,earst om njoggen oere de oare moarns waard er wekker
common_voice_fy-NL_21081245.wav,121388,doe wie hjir dus noch heide
common_voice_fy-NL_21081243.wav,128300,ik ried jo oan in taksy te nimmen
common_voice_fy-NL_21081224.wav,134444,ik freegje mar nei't ik wiis bin
common_voice_fy-NL_21081312.wav,167468,as it daget stiet der in rige auto's fan likernôch in kilometer
common_voice_fy-NL_21081265.wav,107564,lokwinske mei dyn nije baan
common_voice_fy-NL_20889777.wav,152876,us buorman is wat al te goed fan 'e tongrieme snien
common_voice_fy-NL_21081263.wav,175148,hy tinkt te folle yn jild en te min yn maatskiplike knyppunten
common_voice_fy-NL_21081242.wav,142892,ik wol witte hoe't de foarke yn 'e stâle sit
common_voice_fy-NL_21081310.wav,142124,hy woe mei ús prate oer in idee dat er hie
common_voice_fy-NL_21081221.wav,110636,meitsje dat tolve punten
common_voice_fy-NL_21081314.wav,106028,wurd sonder haadletters
common_voice_fy-NL_21081655.wav,116012,soenen wy hjir wat ite kinne
common_voice_fy-NL_21080931.wav,176684,ik doch wat ik kin en stadich giet it de goede kant út
common_voice_fy-NL_21081246.wav,148268,dêr wurdst warch fan sa'n middei te squashen
common_voice_fy-NL_21081204.wav,137516,hja namen in taksy en rieden nei it kleaster
common_voice_fy-NL_21081324.wav,164396,dat waard troch doarpsbelang fan ealahuzen oan de oarder steld
common_voice_fy-NL_21081325.wav,103724,gean nei de ein fan de alinea
common_voice_fy-NL_21081313.wav,158252,ferline wike hat in hynder my der fjirtjin kear ôf smiten
common_voice_fy-NL_21081143.wav,132908,faak wurdt se midden yn 'e nacht gûlend wekker
common_voice_fy-NL_21081311.wav,148268,sa'n jonker kin noch in protte foar sa'n doarp betsjutte
common_voice_fy-NL_21081107.wav,122156,hja woe dat wy trochgiene mei oefenjen
common_voice_fy-NL_21081672.wav,151340,hja hie it hert heech en blommen yn it hier
common_voice_fy-NL_21081264.wav,168236,by dy oerfal kamen twa minsken om troch plysjekûgels
common_voice_fy-NL_21081322.wav,97580,wat hasto dêrmei fanneden
common_voice_fy-NL_21081266.wav,116780,ik ha tsien jier yn de bou sitten
common_voice_fy-NL_21081049.wav,116012,it is mei sizzen net te dwaan
common_voice_fy-NL_21081262.wav,120620,no rint it swit my wer yn 'e eagen
common_voice_fy-NL_21081658.wav,132908,binne jo no ek noch op de wetterlieding oansluten
common_voice_fy-NL_21081323.wav,96812,hy fielt him net goed
common_voice_fy-NL_21081657.wav,145196,mei sa'n man meie wy ús de hannen wol tichtknipe
common_voice_fy-NL_21081326.wav,245804,dy konklúzje wurdt lutsen nei in ûndersyk dêr't tritich bedriuwen en ynstânsjes oan meiwurken
common_voice_fy-NL_21081654.wav,114476,sko omheech
common_voice_fy-NL_21081659.wav,167468,op basis fan it ûntwerp stelle wy de systeemspesifikaasjes op
common_voice_fy-NL_21081788.wav,226604,as fysioterapeut behannelje jo lju dy't troch in dokter trochferwiisd binne
common_voice_fy-NL_21081791.wav,165932,benammen op sosjale media kriget er der fan lâns
common_voice_fy-NL_21081671.wav,153644,ik moat noch snoeie sadat de tún yn de maitiid wer moai is
common_voice_fy-NL_21081811.wav,175916,hja is in frou mei ideeën en mei in útsprutsen noas foar talint
common_voice_fy-NL_21081836.wav,227372,de polysje krige ferline wike sneintemoarn in melding fan lûdsoerlêst
common_voice_fy-NL_21081207.wav,208940,de tragyske kanten fan de leafde sprekke al iuwenlang ta de ferbylding
common_voice_fy-NL_21081726.wav,129068,beide ha jierren omrûn mei har geheim
common_voice_fy-NL_21081724.wav,206636,alles dêr't gjin ferklearring foar te finen is wurdt taskreaun oan kweageasten
common_voice_fy-NL_21081813.wav,161324,de dyk is tydlik ticht om de frachtwein wer út de sleat te heljen
common_voice_fy-NL_21081814.wav,165164,wy naaiden hurd út as siet de kweade ús op 'e hakke
common_voice_fy-NL_21081812.wav,109868,wêr soenen we no telâne komme
