wav_filename,wav_filesize,transcript
common_voice_fy-NL_20756963.wav,126764,let yn de sneintenacht lutsen sniebuien oer fryslân
common_voice_fy-NL_20756939.wav,96044,hy krige der spul oer mei syn mem
common_voice_fy-NL_20756967.wav,131372,lang om let berikke wy krekt foar trijen de finish
common_voice_fy-NL_20756950.wav,108332,amsterdam is de haadstêd fan nederlân
common_voice_fy-NL_20756964.wav,124460,neffens de polysje is de man út kollum dyjinge dy't de auto bestjoerde
common_voice_fy-NL_20756961.wav,129836,safolle besikers hiene de organisatoaren net ferwachte
common_voice_fy-NL_20756956.wav,128300,de polysje slút mear oanhâldingen yn dizze saak net út
common_voice_fy-NL_20756966.wav,212780,de fytsleafhawwers dy't har fan tefoaren ynskriuwe krije in lunchpakket mei foar ûnderweis
common_voice_fy-NL_20756949.wav,171308,troch syn kollega's waard er op it idee brocht om mei fotografearjen te begjinnen
common_voice_fy-NL_20756968.wav,140588,senuwen binne der altyd mar de grutste spanning is der no wol ôf
common_voice_fy-NL_20756951.wav,132140,minsken kinne de petysje tekenje oant en mei tiisdeitejûn
common_voice_fy-NL_20756943.wav,152876,seleksje achterút útwreidzje mei sân alinea's
common_voice_fy-NL_20756953.wav,158252,de jongerein traktearre de plysje op in rein fan benzinebommen en stiennen
common_voice_fy-NL_20756969.wav,135212,wy prate ôf datst nije wike saterdei om healwei fjouweren hjir komst
common_voice_fy-NL_20756971.wav,91436,ik bin grutsk op mysels
common_voice_fy-NL_20756972.wav,136748,yn de rige stiet in moaie frou mei donker krolhier
common_voice_fy-NL_20756960.wav,134444,de ôfrûne wike rûn de politike spanning stadichoan op
common_voice_fy-NL_21407234.wav,140588,in kertier letter stie ik yn in prachtige tún
common_voice_fy-NL_20756965.wav,163628,der wie noch in plakje frij neist in âlde frou mei in felgrien mûtske
common_voice_fy-NL_20756940.wav,97580,yn dy omkriten wie it allegear heide
common_voice_fy-NL_21407232.wav,215084,mocht in ynbrekker deryn komme dan is it hús noch útrêste mei bewegingsmelders
common_voice_fy-NL_21407231.wav,211244,mail sybren oer de nije plannen
common_voice_fy-NL_21407233.wav,165164,sûnt de simmer wurdt iris foar har twang behannele
common_voice_fy-NL_21407314.wav,76844,keapje dit nûmer
common_voice_fy-NL_21407311.wav,188204,alles is grappich salang't it mei in oar bart
common_voice_fy-NL_20756970.wav,125996,it hert waard my weak om't ik fan harren skiede moast
common_voice_fy-NL_20756958.wav,175148,de auteurs stribje folsleinens nei sûnder yn oerstallige details te ferfallen
common_voice_fy-NL_21407367.wav,176684,it evenemint begjint om tsien oere mei in run oer ferskate ôfstannen
common_voice_fy-NL_21407738.wav,111404,der foel neat mei him te begjinnen
common_voice_fy-NL_21407368.wav,140588,ik ha yn de ôfrûne perioade wat te folle meimakke
common_voice_fy-NL_20756959.wav,91436,it drachtster sikehús
common_voice_fy-NL_21407370.wav,125228,as it wetter sakket kreaket it iis
common_voice_fy-NL_21407312.wav,165164,gean fiif wurden nei lofts
common_voice_fy-NL_20756955.wav,138284,dy man is de hiele dei fan hús en syn frou hat gjin wurk
common_voice_fy-NL_21407366.wav,194348,der is it hiele wykein in fotograaf dy't fan elkenien in aksjefoto meitsje sil
common_voice_fy-NL_21407369.wav,138284,ik soe graach in kaartsje keapje wolle
common_voice_fy-NL_21407712.wav,132908,de auto is mei grut geweld iepenbrutsen
common_voice_fy-NL_21407717.wav,195884,de gaswolk wie gefaarlik foar de sûnens fan minske en bist
common_voice_fy-NL_21407740.wav,94508,ik woe wol troch de grûn
common_voice_fy-NL_21407865.wav,94508,wat sil ik jûn ite
common_voice_fy-NL_21407710.wav,125228,dy't in bulte begrypt kin ek folle ferjaan
common_voice_fy-NL_21407719.wav,163628,sûnt wannear hawwe wy in faam foar de húshâlding
common_voice_fy-NL_21407836.wav,202028,de polysje hat in fjoerwapen en kompjûterskiven yn beslach naam
common_voice_fy-NL_21407833.wav,115244,display útsette
common_voice_fy-NL_21407866.wav,241964,der wie in ploechje jonges bolbjirken oan it bierdrinken
common_voice_fy-NL_21407834.wav,80684,wat skrok ik
common_voice_fy-NL_21407852.wav,176684,it plattelân rint leech want der is gjin wurk
common_voice_fy-NL_21407849.wav,178988,it petear gong hielendal de ferkearde kant út
common_voice_fy-NL_21407847.wav,207404,soe ik hjir kaartsjes foar it festival keapje kinne
common_voice_fy-NL_21407882.wav,199724,ynienen seach ik har stean yn har nachtpon yn de iepen keukensdoar
common_voice_fy-NL_20756922.wav,99116,ik set wer ôf ik moat wer oan it wurk
common_voice_fy-NL_21407313.wav,119084,dit hat de moaiste dei fan myn libben west
common_voice_fy-NL_21407864.wav,184364,moandeitejûn rekken twa auto's inoar mei de sydspegels
common_voice_fy-NL_21407851.wav,192044,de grypepidemy yn ús lân giet op syn lêste skonken
common_voice_fy-NL_21407862.wav,140588,miskien is de plysje al ûnderweis
common_voice_fy-NL_21407739.wav,165164,der is in kurator oansteld dy't him oer de sitewaasje bûge sil
common_voice_fy-NL_21407901.wav,94508,ik koe der neat oan dwaan
common_voice_fy-NL_21407885.wav,211244,nij barren foar de hiele dei meitsje
common_voice_fy-NL_21407741.wav,240428,it binne foaral de oantallen ferkearsslachtoffers dy't opfalle
common_voice_fy-NL_21407927.wav,132908,sykje fegetaryske resepten op
common_voice_fy-NL_21407928.wav,111404,ferbetterje de wrâld en begjin by dysels
common_voice_fy-NL_21407908.wav,96044,al dwaande leart men
common_voice_fy-NL_21407884.wav,169004,it waard fris en yn 'e fierte seagen se de ivige snie
common_voice_fy-NL_21407899.wav,138284,ik prakkesearje der net oer
common_voice_fy-NL_21407863.wav,126764,pas patroan ta op dizze rige
common_voice_fy-NL_21407898.wav,148268,der wie in soad publike belangstelling foar de rjochtsaak
common_voice_fy-NL_21407315.wav,107564,dat oare hús is folle better as dit
common_voice_fy-NL_21407930.wav,165164,lit myn namme derbûten om myn famylje net yn gefaar te bringen
common_voice_fy-NL_21407929.wav,140588,hja docht de eagen iepen en sjocht him oan
common_voice_fy-NL_21407910.wav,159788,de twa binne deade doe't se besochten om te flechtsjen
common_voice_fy-NL_21407907.wav,125228,dat liet ik my gjin twa kear sizze
common_voice_fy-NL_21407931.wav,169004,asto tefreden bist mei in seis dan is dat dyn eigen ôfwaging
common_voice_fy-NL_21407912.wav,125228,wy hawwe in hús by it wetter hierd
common_voice_fy-NL_21407886.wav,194348,de toan fan de bugel is weaker en mylder as dy fan de trompet
common_voice_fy-NL_20756892.wav,120620,it is wier prachtich
common_voice_fy-NL_20756929.wav,73004,wat is it ferskil
common_voice_fy-NL_21407986.wav,172844,de polysje kaam de man op it spoar fia anonime tips
common_voice_fy-NL_21407914.wav,125228,it ding moat likegoed nochal wat koste ha
common_voice_fy-NL_21407938.wav,199724,de drugs sieten ferburgen yn konteners mei as einbestimming switserlân
common_voice_fy-NL_21407883.wav,171308,alles yn dizze rige dêrwei helje
common_voice_fy-NL_21407970.wav,163628,mar ik hie nea tocht dat dit ek echt wichtich wie
common_voice_fy-NL_21407984.wav,79148,e mail beäntwurdzje
common_voice_fy-NL_21407958.wav,163628,troch twa falske starts mocht hja net mear meidwaan
common_voice_fy-NL_21407940.wav,88364,doch de lampen út
common_voice_fy-NL_21407941.wav,99884,it is tsien minuten rinnen
common_voice_fy-NL_21407959.wav,103724,ik haw wat op dy man tsjin
common_voice_fy-NL_21407967.wav,195884,oft der in ferbân is tusken de ferskate fermissingen is noch net dúdlik
common_voice_fy-NL_21407939.wav,94508,dat kin de brune net lûke
common_voice_fy-NL_21407969.wav,96044,ik ha dêr in soad nocht oan
common_voice_fy-NL_21407960.wav,171308,hja nimt yn har wurk stikje by bytsje mear ferantwurdlikheid op har
common_voice_fy-NL_21408007.wav,215084,underweis dielde de jeugd aksjekaarten út omdat se ferlet hawwe fan sponsors
common_voice_fy-NL_21408010.wav,84524,belje wytse op it wurk
common_voice_fy-NL_21407985.wav,169004,yn 'e softwareyndustry binne in soad bedriuwen sûnder gesicht
common_voice_fy-NL_21408043.wav,119084,jo kinne dêr sels ek it nedige oan dwaan
common_voice_fy-NL_21408001.wav,99884,ik haw him yn lang net sjoen
common_voice_fy-NL_21408009.wav,109868,ingelsen boartsje graach mei wurden
common_voice_fy-NL_21408000.wav,132908,ik fyn ús konsjerzje de aardichste
common_voice_fy-NL_21408044.wav,194348,freedtemiddei wie der in berneprogramma yn de feesttinte
common_voice_fy-NL_21408030.wav,209708,ik sit hjir mar yn 'e hûs ivich en erflik tusken dy ellindige perzikbeammen
common_voice_fy-NL_21407999.wav,203564,it is net wis oft de polderdiken en wâlskanten it mei min waar hâlde
common_voice_fy-NL_21408045.wav,142124,de measte hurdfytsers koene it tempo net folgje
common_voice_fy-NL_21407998.wav,213548,der binne op skylge sechstich oant santich kampearterreinen fertelde men dêre
common_voice_fy-NL_21407961.wav,99884,ik wit my gjin rie
common_voice_fy-NL_21408046.wav,188204,de earste oranjebitters waarden heefd mei in toast op 'e koaning
common_voice_fy-NL_21408028.wav,188204,it plan waard ôfrûne freed troch it kabinet goedkard
common_voice_fy-NL_21408011.wav,126764,ik bin dêr net sa mei dwaande mar men seit it
common_voice_fy-NL_21408029.wav,184364,wy krigen yn elk gefal de yndruk dat men graach oan de gasten fertsjinnet
common_voice_fy-NL_21408031.wav,305708,de oanfregers fan it referindum wolle graach dat it kombinearre wurdt mei de steateferkiezings
common_voice_fy-NL_21408064.wav,184364,alle mooglike probleemgebieten kinne oan bod komme yn 'e terapy
common_voice_fy-NL_21408079.wav,126764,blêdzje troch gurbe douwstra
common_voice_fy-NL_21408066.wav,192044,wy binne bliid dat wy minsken yn dit soarte fan omstannichheden helpe kinne
common_voice_fy-NL_21408063.wav,122924,do hast de beurs yn it laad ferstoppe
common_voice_fy-NL_21408062.wav,149804,hy rint deromhinne as de hûn om in stikelbaarch
common_voice_fy-NL_21408077.wav,169004,de bisten meitsje gongen en frette de woartels fan it gers oan
common_voice_fy-NL_21408099.wav,192044,sân moannen lei ik thús op bêd te wachtsjen oant ik better wurde soe
common_voice_fy-NL_21408081.wav,94508,hoe sprekst dy sin út
common_voice_fy-NL_21408097.wav,178988,foar in ynstitút dat net bestiet hoecht fansels ek net betelle te wurden
common_voice_fy-NL_21408080.wav,199724,wy advisearje jo om by kâlde nachten ekstra strie yn it nachthok te dwaan
common_voice_fy-NL_21408065.wav,119084,spaansk restaurant
common_voice_fy-NL_21408116.wav,184364,de útstream fan klanten is like grut as de ynstream fan nije klanten
common_voice_fy-NL_21408130.wav,178988,it ûngelok mei de roeiboat barde ferline wike sneontemoarn
common_voice_fy-NL_21408114.wav,171308,lit de e mail fan bart fan juster sjen
common_voice_fy-NL_21408042.wav,122924,it brocht syn soan net op it rjochte paad
common_voice_fy-NL_21408127.wav,117548,seleksje omheech útwreidzje
common_voice_fy-NL_21408151.wav,172844,it fryske keninkryk wie folle lytser as oant no ta tocht
common_voice_fy-NL_21408098.wav,161324,yn it tsjinstesintrum kinst wat drinke en wat ite
common_voice_fy-NL_21408078.wav,163628,ast middeis by de trep op kaamst seachst har fuort sitten
common_voice_fy-NL_21408131.wav,111404,belje dat lêste nûmer op 'e nij
common_voice_fy-NL_21408101.wav,236588,it selskip krige neist in bedriuwspresintaasje in rûnlieding troch it produksjebedriuw
common_voice_fy-NL_21408140.wav,172844,beäntwurdzje de mail fan stefan sorry foar it misferstân
common_voice_fy-NL_21408152.wav,163628,famkes en jonges wa wit hoe âld as ús koaning is
common_voice_fy-NL_21408148.wav,145964,it bleau by wurden mar dieden ho mar
common_voice_fy-NL_21408100.wav,172844,oan 'e ein fan 'e middei soene wy wer ophelle wurde troch it boatsje
common_voice_fy-NL_21408129.wav,132908,ferbergje de folgjende kolom
common_voice_fy-NL_21408139.wav,176684,de plysje tinkt dat it slachtoffer by de krusing gjin foarrang jûn hat
common_voice_fy-NL_21408149.wav,126764,syn muoike hie in som jild op him fêstset
common_voice_fy-NL_21408150.wav,148268,learkrêften fiele noch altyd de rop om les te jaan
common_voice_fy-NL_21408178.wav,119084,kleurje dizze rigel giel
common_voice_fy-NL_21408153.wav,80684,it stjonkt hjir
common_voice_fy-NL_21408162.wav,138284,se klapte har boek ticht en joech my in nachttút
common_voice_fy-NL_21408177.wav,161324,sensoaren regelje wannear't de brêge wer tichtgiet
common_voice_fy-NL_21408154.wav,103724,skoftsje de muzyk
common_voice_fy-NL_21408138.wav,165164,hy hat rekken te hâlden mei de realiteit fan de ynlânske polityk
common_voice_fy-NL_21407982.wav,149804,it flakke lân it polderlân dat lûkt my oan
common_voice_fy-NL_21408164.wav,171308,stjoer kees in tekstberjocht
common_voice_fy-NL_21408156.wav,119084,juster haw ik him in pear rigels skreaun
common_voice_fy-NL_21408155.wav,109868,wiskje al myn oantinkens
common_voice_fy-NL_21408179.wav,157484,hoefolle itensleppels geane der yn in mingel
common_voice_fy-NL_21408166.wav,184364,dêr binne de lêste jierren hiel wat deiblêdartikels oer ferskynd
common_voice_fy-NL_21408197.wav,169004,yn dit duel diktearren de gasten it ferrin fan 'e wedstriid
common_voice_fy-NL_21407997.wav,119084,dêr is de wrâld mei kranten tichtplakt
common_voice_fy-NL_21408187.wav,167468,yn 'e deistige praktyk komt de manager foar heel wat fragen te stean
common_voice_fy-NL_21408189.wav,119084,liuwe hat in soad boeken yn syn keamer
common_voice_fy-NL_21408200.wav,132908,yn dizze baan moatst twa wykeinen yn 'e moanne wurkje
common_voice_fy-NL_21408190.wav,115244,dat liezen wy yn de krante yn frankryk
common_voice_fy-NL_21408191.wav,125228,krysttiid âld en nij om my hoecht it net
common_voice_fy-NL_21408163.wav,144428,skoaten folgen inoar yn heech tempo op
common_voice_fy-NL_21408199.wav,119084,sa is it him ommers altiten oanpraat
common_voice_fy-NL_21408165.wav,148268,by in brân is sneontenacht in wenwein ferlern gien
common_voice_fy-NL_21408210.wav,117548,tocht se dat se net lang mear libje soe
common_voice_fy-NL_21408209.wav,119084,hy hie sin oan in flaubyt in broadsje of sa
common_voice_fy-NL_21408230.wav,157484,nei't ik troch de rêch gien wie haw ik in wike net traine kinnen
common_voice_fy-NL_21408224.wav,111404,dat oare hûs is folle better as dit
common_voice_fy-NL_21408194.wav,130604,ik ha each foar de nijste trends en folgje dy
common_voice_fy-NL_21408188.wav,109868,wat ha je oan dy trije kranten
common_voice_fy-NL_21408228.wav,157484,in learling kin ek kieze foar de kombinaasje wurkje leare
common_voice_fy-NL_21408201.wav,88364,list fan programma
common_voice_fy-NL_21408008.wav,125228,dy jonge dêr sit wol in goede skoalmaster yn
common_voice_fy-NL_21408211.wav,125228,ik wol ek noch graach in glês wetter by it iten
common_voice_fy-NL_21408248.wav,103724,it like my fuort al net goed ta
common_voice_fy-NL_21408232.wav,132908,miranda hearde it oan en tocht der harres fan
common_voice_fy-NL_21408231.wav,142124,dat liet er moandeitejûn yn in ferkiezingsdebat witte
common_voice_fy-NL_21408195.wav,103724,ik leau it sels ek noch net
common_voice_fy-NL_21408192.wav,184364,ik fielde dat ik net roppen wie om engazjearre boeken te skriuwen
common_voice_fy-NL_21408249.wav,178988,de diken kinne net breder makke wurde want dêr is gjin rûmte foar
common_voice_fy-NL_21408256.wav,161324,hy flokte faak en as er lulk wie dan wie it hús te lyts
common_voice_fy-NL_21408225.wav,107564,meie wy de auto by de tinte stean litte
common_voice_fy-NL_21408196.wav,126764,dizze minsken wurkje yn in sosjale wurkpleats
common_voice_fy-NL_21408261.wav,119084,hja hat him de earm om de skouders slein
common_voice_fy-NL_21408259.wav,99884,dêr haw ik net folle idee oer
common_voice_fy-NL_21408027.wav,157484,de beurs jout rûmte oan sa'n twahûndert eksposanten
common_voice_fy-NL_21408255.wav,122924,de trep is links en dan is it rjochts
common_voice_fy-NL_21408263.wav,155948,meitsje de letters tsien punten times yn it wurd
common_voice_fy-NL_21408223.wav,163628,hja wurket op tiisdei en woansdei op de praktyk
common_voice_fy-NL_21408272.wav,169004,binne der ek museums hjir yn de omkriten dy't jo ús oanriede kinne
common_voice_fy-NL_21408229.wav,132908,har ûntslach is ûnjildich wy moatte har wer oannimme
common_voice_fy-NL_21408258.wav,155948,ik haw freedtemoarn eefkes mei him prate mocht
common_voice_fy-NL_21408271.wav,215084,begjin dizze moanne waard bekend hoe bysûnder as it giel blauwe skaaltsje eins is
common_voice_fy-NL_21408193.wav,149804,ik tink dat je dêr in protte tiid en enerzjy yn stekke moatte
common_voice_fy-NL_21408264.wav,117548,wy moatte ús oan de regels hâlde
common_voice_fy-NL_21408280.wav,155948,ik lês trije kranten deis en dy lês ik goed
common_voice_fy-NL_21408260.wav,178988,yn de skoalle binne posters ophinge mei dêrop tsien regels fan respekt
common_voice_fy-NL_21415063.wav,155948,hja ferdwûn sonder foarm fan proses yn de finzenis
common_voice_fy-NL_21408262.wav,115244,de dagen dêrnei kaam ik der net út
common_voice_fy-NL_21408273.wav,188204,oandacht en kreativiteit binne soms wol en soms net oan tiid bûn
common_voice_fy-NL_21415121.wav,92204,de dyk is ôfsletten
common_voice_fy-NL_21408247.wav,202028,it fisum wie goedkard en wie dy tongersdeis ferstjoerd
common_voice_fy-NL_21408274.wav,119084,ik bin mei de fyts fallen
common_voice_fy-NL_21408141.wav,152108,janneke is net sa'n aksjefierster mar hjoed giet se de strjitte op
common_voice_fy-NL_21415091.wav,184364,der is yn dy fjirtich jier nochal wat feroare op it tsjerklik mêd
common_voice_fy-NL_21415123.wav,268844,begjin dizze moanne waard bekend hoe bysûnder as it grien giele skaaltsje eins is
common_voice_fy-NL_21415119.wav,153644,myn omkesizzer kin wol even helpe dy hat der wol aardich sicht op
common_voice_fy-NL_21408270.wav,96044,it wie tsjin njoggenen
common_voice_fy-NL_21415138.wav,176684,de kursisten hawwe rjocht op folsleine weromjefte fan it kursusjild
common_voice_fy-NL_21415141.wav,148268,se dûkte yn skotlân yn iiskâld wetter
common_voice_fy-NL_21408284.wav,157484,tsjin wyn en stream is 't min roeien
common_voice_fy-NL_21415125.wav,142124,dêr wienen faak de ferkearde minsken it slachtoffer fan
common_voice_fy-NL_21408283.wav,75308,wiskje dat
common_voice_fy-NL_21408245.wav,117548,kleurje dizze seleksje read
common_voice_fy-NL_21415226.wav,149804,de fakânsje sil fertraging jaan
common_voice_fy-NL_21415251.wav,132908,dit bedriuw leit by in soad klanten op in goede namme
common_voice_fy-NL_21415227.wav,163628,jo plysjes hawwe my yninoar slein kommissaris
common_voice_fy-NL_21415248.wav,138284,hja helle de kaai út it kontakt en stapte út
common_voice_fy-NL_21415281.wav,94508,selektearje de alinea
common_voice_fy-NL_21415328.wav,175148,in dichter dy't ús yn dy tiid sterk fassinearre wie rilke
common_voice_fy-NL_21415136.wav,125228,doe't ik lyts wie wenne ik yn in doarp
common_voice_fy-NL_21415276.wav,167468,de protters litte har no al fjirtjin dagen lang alle middeis sjen
common_voice_fy-NL_21415321.wav,117548,simmerdei meie wy graach iis
common_voice_fy-NL_21415124.wav,184364,pas sûnt achttjin sechstich hat de frou út de hegere stannen in ûnderbroek oan
common_voice_fy-NL_21415093.wav,132908,jou my de temperatuer op it stuit yn 'e hûs
common_voice_fy-NL_21415228.wav,94508,gean nei de ein fan it dokumint
common_voice_fy-NL_21415352.wav,96044,ik bin bliid dat jimme hjir binne
common_voice_fy-NL_21415353.wav,207404,it docht bliken dat ûngefear ien op de seis pearen gjin bern krije kin
common_voice_fy-NL_21415230.wav,163628,nee it is neat feroare it is praktysk noch allegear persiis gelyk
common_voice_fy-NL_21453128.wav,157484,it is in moaie samling
common_voice_fy-NL_21415354.wav,155948,ofspyllist ôfdraaie
common_voice_fy-NL_21466851.wav,125228,doch it ljocht oan
common_voice_fy-NL_21452819.wav,215084,mei dit wurk is de tekener it meast bekend wurden
common_voice_fy-NL_21466011.wav,172844,hâld op wy hawwe it dêr al wittefaak oer hân
common_voice_fy-NL_21415325.wav,140588,ik haw ûntdutsen dat der ek in oare kant fan de medalje is
common_voice_fy-NL_21466147.wav,161324,alle regionale omroppen moatte besunigje
common_voice_fy-NL_21466010.wav,234284,jongere wurknimmers binne gefoeliger foar stress op it wurk as âldere wurknimmers
common_voice_fy-NL_21453162.wav,184364,de polysje trappearre de mannen op 'e die
common_voice_fy-NL_21466855.wav,221228,heit wie doe oer de tachtich en mem mear as santich jier
common_voice_fy-NL_21415137.wav,180524,hjir soene wy ús dus eigentlik écht drok oer meitsje moatte
common_voice_fy-NL_21466870.wav,251948,it is tiid om doarren en finsters iepen te setten nei de nije wrâld
common_voice_fy-NL_21466153.wav,217388,alle pasjinten wurde ûnderbrocht yn oare sikehuzen
common_voice_fy-NL_21415306.wav,122924,justermiddei kaam er mei de finger tusken de doar
common_voice_fy-NL_21453017.wav,218924,gjinien fan de meiwurkers wie telefoanysk te berikken
common_voice_fy-NL_21453068.wav,192044,hy waard misbrûkt troch in sportlieder
common_voice_fy-NL_21453067.wav,228908,ik hie earlik sein al yn gjin moannen mear oan har tocht
common_voice_fy-NL_21415351.wav,184364,dizze regeling wurdt ynfierd om spekulaasje foar te kommen
common_voice_fy-NL_21453020.wav,199724,wat bart der as it tiidrek fan fiif jier foarby is
common_voice_fy-NL_21453163.wav,184364,hoefolle minsken wenje der yn new york
common_voice_fy-NL_21415139.wav,163628,der moatte noch oanlisplakken makke wurde yn it sintrum
common_voice_fy-NL_21467037.wav,159788,sa en no sil ik ek wat ite hear
common_voice_fy-NL_21466852.wav,257324,us beppe joech my in stik witebôle mei boerebûter en in laachje brune sûker
common_voice_fy-NL_21466999.wav,138284,ik ha it op skoalle net nei it sin
common_voice_fy-NL_21466891.wav,228908,dus moatst sûnder de bal altyd frijrinne foar de meispilers
common_voice_fy-NL_21467063.wav,90668,hoedatsa
common_voice_fy-NL_21467076.wav,221228,moandeitemoarn is in man slim ferwûne rekke nei in fal troch in dak
common_voice_fy-NL_21466998.wav,159788,fan no ôf sil hy myn begelieder wêze
common_voice_fy-NL_21467038.wav,178988,betanke foar alles en do hearst grif noch fan ús
common_voice_fy-NL_21467040.wav,228908,it sop wurdt yn in hiel koart skoft hjit makke sadat it kymfrij is
common_voice_fy-NL_21467082.wav,268844,peaskesaterdei is de saterdei foar peaske en de lêste dei fan de lijenswike
common_voice_fy-NL_21466919.wav,215084,nei ôfrin binne wy in kafee yn gien oant wy sin oan iten krigen
common_voice_fy-NL_21466918.wav,138284,hâld dy fêst
common_voice_fy-NL_21467251.wav,192044,troch de rûzjes is de gesellichheid thús fier te sykjen
common_voice_fy-NL_21477438.wav,113708,ferwiderje wurd
common_voice_fy-NL_21467057.wav,186668,der siet foar my neat oars op as mar fuort te gean
common_voice_fy-NL_21467278.wav,171308,de helte fan de tiid is der gewoan gjin nijs
common_voice_fy-NL_21408207.wav,103724,dit is noch mar it begjin
common_voice_fy-NL_21477554.wav,142124,dat giet my boppe it ferstân
common_voice_fy-NL_21477569.wav,226604,de plysje hat efterhelle wa't mandélich wiene oan it wangedrach
common_voice_fy-NL_21467064.wav,284204,it giele plak of de macula lutea leit midden efter op it netflues
common_voice_fy-NL_21477439.wav,167468,hy komt wol werom sit der mar net oer yn
common_voice_fy-NL_21467298.wav,134444,besite kaam der amper
common_voice_fy-NL_21477531.wav,205868,ik ha my altyd al ôffrege wat se yn him seach
common_voice_fy-NL_21477440.wav,218924,dat is in dúdlik sinjaal dêr't gjin misbegryp oer wêze kin
common_voice_fy-NL_21477511.wav,221228,myn âldelju hawwe tige sober libbe en nea de hân ophâlden
common_voice_fy-NL_21477552.wav,178988,hja drinke en dûnsje en meitsje it let
common_voice_fy-NL_21477561.wav,175148,ik fyn soks net slim as ik it mar op 'e tiid wit
common_voice_fy-NL_21477528.wav,205868,guon fan dy gedichten binne sa sterk dat se tiden meikinne
common_voice_fy-NL_21477473.wav,263468,moandeitemoarn waard in moadesaak oan de alde slûs slachtoffer fan in raamkreak
common_voice_fy-NL_21477607.wav,136748,se moat har hús ferkeapje
common_voice_fy-NL_21477630.wav,190508,hy reizge mei syn programma fan lêzingen dwers troch europa
common_voice_fy-NL_21466868.wav,178988,wy besykje jild byinoar te krijen foar dat goeie doel
common_voice_fy-NL_21477597.wav,159788,as it heel slim is helje dan in dokter
common_voice_fy-NL_21477663.wav,194348,hy fynt dat deputearre steaten fierstente folle ôfwachtsje
common_voice_fy-NL_21477695.wav,175148,hoefolle kilometer is it noch nei it folgjende parkearplak
common_voice_fy-NL_21477562.wav,125228,folle stadiger
common_voice_fy-NL_21477647.wav,175148,ik wol graach betelje hoefolle is dat mei inoar
common_voice_fy-NL_21479548.wav,172844,it jild is de as dêr't alles om draait
common_voice_fy-NL_21479530.wav,295724,alkoholist neamt er himsels net mear in sosjale drinker in gesellige drinker
common_voice_fy-NL_21479520.wav,207404,de amtners steane boargers allinnich moarns telefoanysk te wurd
common_voice_fy-NL_21479553.wav,165164,wieke sei dat hja skjin ynein wie
common_voice_fy-NL_21479542.wav,205868,de brief wie mei de hân skreaun en siet yn in klassike slúf
common_voice_fy-NL_21477550.wav,245804,dit nije bewiismateriaal is de polysje yn hannen spile troch in anonime frou
common_voice_fy-NL_21479528.wav,180524,it spiet him dat er mar in pear jier legere skoalle hie
common_voice_fy-NL_21477648.wav,195884,troch de grize loft hinne kin men de sinne fiele
common_voice_fy-NL_21477579.wav,149804,hjir wurdt noch neier ûndersyk nei dien
common_voice_fy-NL_21467277.wav,234284,yn 'e betide nacht fan sneon op snein moast de plysje yngripe by fjochterij
common_voice_fy-NL_21477578.wav,134444,druk de seleksje ôf
