wav_filename,wav_filesize,transcript
common_voice_sv-SE_21311438.wav,131372,vad vet vi om hans bakgrund
common_voice_sv-SE_21311420.wav,139052,vår tjuv tycks ha tagit sin belöning trots allt
common_voice_sv-SE_21311306.wav,200492,du är väldigt självbelåten för att vara en man som nyss blivit rånad
common_voice_sv-SE_20932607.wav,179756,jag har kollat det är inte kondensatorn
common_voice_sv-SE_21311314.wav,94508,hörde du vad jag sa
common_voice_sv-SE_21311421.wav,89900,hur coolt är det
common_voice_sv-SE_21311423.wav,140588,personen har ögon och hår som stämmer med offret
common_voice_sv-SE_21311430.wav,127532,de ballar ur om vi hämtar klienter i den
common_voice_sv-SE_21311435.wav,139820,har mänskligheten blivit utplånad
common_voice_sv-SE_20790515.wav,89900,jag kan ordna det
common_voice_sv-SE_21311343.wav,99116,jag tror dig inte
common_voice_sv-SE_21311456.wav,129068,ni har inte setts på åratal
common_voice_sv-SE_21311452.wav,119084,lova att jag får tillbaka den här
common_voice_sv-SE_21311462.wav,105260,välkomna till budapest
common_voice_sv-SE_20932674.wav,139820,du hör hemma på dårhuset
common_voice_sv-SE_21311320.wav,95276,du måste vara en man nu
common_voice_sv-SE_21311463.wav,102956,vad gör ni
common_voice_sv-SE_20928125.wav,129068,det finns ingen på handelscentret
common_voice_sv-SE_21311482.wav,99116,det var okej
common_voice_sv-SE_21311484.wav,132908,och den nya ägaren kommer att drabbas av olycka
common_voice_sv-SE_21311464.wav,118316,jag marscherar in och konfronterar honom
common_voice_sv-SE_21311520.wav,97580,jag ringer tillbaka
common_voice_sv-SE_21311461.wav,126764,jag trodde inte mina öron
common_voice_sv-SE_21311517.wav,112172,du skulle inte komma hem idag
common_voice_sv-SE_21311499.wav,108332,du store tid
common_voice_sv-SE_21311500.wav,125228,får vi fråga om anledningen till ditt besök
common_voice_sv-SE_21311498.wav,96044,jag behöver ett gott råd
common_voice_sv-SE_21311450.wav,116780,jag sa att vi måste bort
common_voice_sv-SE_21311424.wav,89132,ni har inga tjejer
common_voice_sv-SE_21311568.wav,92972,jag vet inte säkert
common_voice_sv-SE_21311340.wav,132140,han flyttade in på ett hotell nära henne
common_voice_sv-SE_21311378.wav,157484,tänk att vara tvungen att sälja sina kära ägodelar
common_voice_sv-SE_21311516.wav,109100,vad häftig du är brorsan
common_voice_sv-SE_21311400.wav,89900,de är mindre
common_voice_sv-SE_21311570.wav,83756,jag skriver på
common_voice_sv-SE_21311358.wav,147500,du inser väl att det här inte förändrar något
common_voice_sv-SE_21311519.wav,100652,hon är advokat
common_voice_sv-SE_21311566.wav,98348,kan vi åka till hotellet
common_voice_sv-SE_21311601.wav,88364,var är min son
common_voice_sv-SE_21311567.wav,105260,vill du arbeta med oss
common_voice_sv-SE_21311573.wav,104492,låt mig bara vara
common_voice_sv-SE_21311572.wav,134444,jag fick knappt ut svensexa förrän hon sågade idén
common_voice_sv-SE_21311574.wav,97580,hon gör sådär med tungan
common_voice_sv-SE_21311569.wav,119084,hans bror har förlorat en hand
common_voice_sv-SE_21311363.wav,119084,för att lyssna på ditt meddelande
common_voice_sv-SE_21311579.wav,89900,inte just nu
common_voice_sv-SE_21311576.wav,122924,jag har funderat på att skaffa hund
common_voice_sv-SE_21311432.wav,104492,den ruttnar fort
common_voice_sv-SE_21311355.wav,105260,och tänderna lyser i mörkret
common_voice_sv-SE_21311590.wav,92204,ja vad är det
common_voice_sv-SE_21311481.wav,125996,men han smög sig inte in på skolan
common_voice_sv-SE_21311575.wav,109868,och nu är det inte bara ni två
common_voice_sv-SE_21311453.wav,100652,det är inte min fru
common_voice_sv-SE_21311431.wav,89900,inte hemmafru
common_voice_sv-SE_21311594.wav,145964,jag tror att det är en gyllne möjlighet till pengar och ära
common_voice_sv-SE_21311490.wav,96044,jag finansierade honom
common_voice_sv-SE_21311599.wav,108332,allvarligt du börjar bli skallig
common_voice_sv-SE_21311422.wav,105260,det pirrar lite i magen
common_voice_sv-SE_21311518.wav,182060,om han inte kan garantera en leverans är han inte till någon nytta
common_voice_sv-SE_21311616.wav,133676,du kan torka spyor på mcdonald's
common_voice_sv-SE_21311587.wav,99116,jag kan ta er till klubbar med män
common_voice_sv-SE_21311487.wav,99116,ring om du inte pratar jobb
common_voice_sv-SE_21311628.wav,91436,i min fästning
common_voice_sv-SE_21311618.wav,124460,vi fattar flera beslut varje dag
common_voice_sv-SE_21311636.wav,99884,du ska inte flyga
common_voice_sv-SE_21311637.wav,105260,inte med satmaran där hemma
common_voice_sv-SE_21311630.wav,133676,jag älskar att ge bort saker på min födelsedag
common_voice_sv-SE_21311634.wav,139820,jag kan förstås inte ha företaget utan dig
common_voice_sv-SE_21311639.wav,143660,det är bara dåliga förlorare som sprider rykten
common_voice_sv-SE_21311497.wav,89900,kan ni tro det
common_voice_sv-SE_21311592.wav,112940,det behöver elektricitet
common_voice_sv-SE_21311571.wav,100652,har du pengarna från förra gången
common_voice_sv-SE_21311496.wav,115244,jag ser för löjlig ut
common_voice_sv-SE_21311603.wav,106796,jag kan erövra staden på egen hand
common_voice_sv-SE_21311653.wav,92204,vill du inte skjuta
common_voice_sv-SE_21311651.wav,119084,vi skilde oss när det nu var
common_voice_sv-SE_21311652.wav,94508,lämna henne utanför
common_voice_sv-SE_21318799.wav,116012,du fick åtminstone godkänt
common_voice_sv-SE_21311604.wav,119084,jag åker härifrån som du bad mig att göra
common_voice_sv-SE_21318784.wav,103724,och detta är lustigt
common_voice_sv-SE_21311460.wav,108332,jag ska vara tydlig
common_voice_sv-SE_21318793.wav,107564,vi kan väl åka allesammans
common_voice_sv-SE_21318783.wav,151340,jag går gärna till en klubb om du menar det
common_voice_sv-SE_21318792.wav,101420,jag vill inte höra
common_voice_sv-SE_21318790.wav,92204,vi måste härifrån
common_voice_sv-SE_21318787.wav,119084,kanske han anade det
common_voice_sv-SE_21318795.wav,111404,hövdingen gav dem all mat han kunde
common_voice_sv-SE_21311654.wav,130604,kan du bygga en sån stor robot åt mig en dag
common_voice_sv-SE_21311577.wav,112940,så vad händer nuförtiden
common_voice_sv-SE_21318788.wav,164396,nu är konceptet inte bara att åka till budapest
common_voice_sv-SE_21318798.wav,92972,är han det än
common_voice_sv-SE_21318786.wav,109100,här är ett täcke
common_voice_sv-SE_21318789.wav,109100,varför sa du inget till mig
common_voice_sv-SE_21318802.wav,101420,herrn är allt i sin ordning
common_voice_sv-SE_21318800.wav,130604,vi kan inte förändra det förflutna
common_voice_sv-SE_21311589.wav,103724,kan du sitta barnvakt
common_voice_sv-SE_21318794.wav,99884,vi älskar dig med
common_voice_sv-SE_21318801.wav,112940,ska jag kolla upp mat och överdoser
common_voice_sv-SE_18847607.wav,157484,skitsamma jag tar livet av mig
common_voice_sv-SE_21311580.wav,106796,vi är så glada att berätta
common_voice_sv-SE_18847610.wav,126764,varför begå självmord i badkaret
common_voice_sv-SE_18847618.wav,73004,han är hemma
common_voice_sv-SE_18847609.wav,88364,det är snart november
common_voice_sv-SE_18847608.wav,98348,det var länge sedan
common_voice_sv-SE_18847619.wav,71468,han gick i min klass
common_voice_sv-SE_18847633.wav,88364,inte ett steg närmare
common_voice_sv-SE_18847620.wav,90668,vi måste ta med klienterna hit
common_voice_sv-SE_18847635.wav,86828,det är en guldgruva jag lovar
common_voice_sv-SE_18847661.wav,73004,det är till hantverkaren
common_voice_sv-SE_21311578.wav,98348,de griper brudgummen
common_voice_sv-SE_21311617.wav,158252,det var därför jag hellre ville vara här bland vänner
common_voice_sv-SE_21311633.wav,132908,du ska aldrig få en andel av detta företag
common_voice_sv-SE_18847632.wav,82988,om några dagar jag lovar
common_voice_sv-SE_18847639.wav,94508,hans psykiater ringde mig
common_voice_sv-SE_18847646.wav,88364,okej skål för dig
common_voice_sv-SE_18847636.wav,57644,vad vill ni
common_voice_sv-SE_18847640.wav,145964,era klassföreståndare kommer att gå igenom resten av dagens aktiviteter
common_voice_sv-SE_21311619.wav,105260,min kompis hade en fest
common_voice_sv-SE_18847645.wav,84524,och det gäller er kompis också
common_voice_sv-SE_18847643.wav,86828,vi tar cabrioleten
common_voice_sv-SE_21311615.wav,154412,ville jag se dig död skulle du vara det
common_voice_sv-SE_18847644.wav,73004,är du det
common_voice_sv-SE_21311635.wav,112172,jag menar tänk efter
common_voice_sv-SE_21311638.wav,93740,fattar du vad som hände
common_voice_sv-SE_18847660.wav,92204,jag heter harry förresten
common_voice_sv-SE_18847658.wav,126764,om staden blir en stenhög bryr jag mig noll procent
common_voice_sv-SE_18847641.wav,73004,bra idé va
common_voice_sv-SE_18847655.wav,69164,männen är med oss
common_voice_sv-SE_21311605.wav,109100,nu kan ingen följa efter dem
common_voice_sv-SE_18847659.wav,96044,skulle jag låta dig svälta ihjäl
common_voice_sv-SE_21311640.wav,112172,han försökte inte ens kyssa mig
common_voice_sv-SE_18847656.wav,96044,slippa behöva gömma dig för polisen
common_voice_sv-SE_18847650.wav,56108,om det är vad jag vill
common_voice_sv-SE_18847647.wav,119084,så vi måste sluta och det har jag ju redan
common_voice_sv-SE_18847652.wav,59948,ta dig i häcken
common_voice_sv-SE_18847654.wav,61484,vad vill ni äta
common_voice_sv-SE_21318797.wav,105260,jag röstar på jamaica
common_voice_sv-SE_18847664.wav,84524,och kommer du tillbaka snart
common_voice_sv-SE_18847665.wav,84524,vi ska slå till klockan
common_voice_sv-SE_18847653.wav,73004,hur säger man
common_voice_sv-SE_18847695.wav,71468,tänker du hoppa
common_voice_sv-SE_18847657.wav,76844,behöver du lite hjälp
common_voice_sv-SE_18847692.wav,67628,han bor i min källare
common_voice_sv-SE_18847697.wav,69164,ring mig
common_voice_sv-SE_21318785.wav,167468,för någon med nyfunnen moral är du verkligen pengakåt
common_voice_sv-SE_18847703.wav,121388,så ni kan larva er i parken senare
common_voice_sv-SE_18847699.wav,84524,du sa att han hämtar dem senare
common_voice_sv-SE_18847705.wav,79148,vi eller konkurrenterna
common_voice_sv-SE_18847637.wav,92204,han lyckades rädda många
common_voice_sv-SE_18847708.wav,79148,det är upp till er
common_voice_sv-SE_18847642.wav,79148,jag har fått sparken
common_voice_sv-SE_18847714.wav,82988,du kan väl ge honom dina
common_voice_sv-SE_18847711.wav,76844,ta god tid på dig
common_voice_sv-SE_18847694.wav,69164,en skicklig tjuv
common_voice_sv-SE_21318791.wav,118316,använder du alltid så mycket salt
common_voice_sv-SE_18847621.wav,125228,han hade skickat honom pengar utan att berätta för mig
common_voice_sv-SE_18847843.wav,98348,jag gjorde samma sak för mitt bröllop
common_voice_sv-SE_18847648.wav,67628,vad vill du
common_voice_sv-SE_21318796.wav,133676,jag berättade inte om det för du hade sagt nej
common_voice_sv-SE_18847715.wav,98348,därför att det är mitt liv harry
common_voice_sv-SE_18847634.wav,90668,och ni kan skratta
common_voice_sv-SE_18847844.wav,99884,och det har ändå inget med saken att göra
common_voice_sv-SE_18847845.wav,98348,det är lättare att förlora än att få
common_voice_sv-SE_18847846.wav,65324,stå stilla
common_voice_sv-SE_18847611.wav,102188,som den här tjejen
common_voice_sv-SE_18847842.wav,113708,tur att jag inte är där annars hade jag knuffat dig
common_voice_sv-SE_18847852.wav,76844,kan jag få hans adress
common_voice_sv-SE_18847853.wav,76844,och ni själv
common_voice_sv-SE_18847854.wav,76844,knuffa den jäveln
common_voice_sv-SE_18847855.wav,115244,jag tänker ta en väldigt lång och väldigt varm dusch
common_voice_sv-SE_18847701.wav,106028,många elever hoppar av på grund av skörden
common_voice_sv-SE_18847860.wav,102188,vems rum tror du att du är i
common_voice_sv-SE_18847651.wav,75308,ska jag sätta på tvn åt dig
common_voice_sv-SE_18847662.wav,69164,kan vi snabba på lite
common_voice_sv-SE_18847856.wav,152108,tjuvarna på var sida om kristus vid korsfästelsen
common_voice_sv-SE_18847666.wav,71468,din maria
common_voice_sv-SE_18847859.wav,96044,kan du sluta skrika på mig
common_voice_sv-SE_18847649.wav,69164,lita på det
common_voice_sv-SE_18847713.wav,63788,du är dig lik
common_voice_sv-SE_18847870.wav,76844,snacka inte skit
common_voice_sv-SE_18851017.wav,86828,vänta har du något att säga
common_voice_sv-SE_18847638.wav,82988,vem är någonsin lycklig
common_voice_sv-SE_18847869.wav,126764,spelar katolska präster ofta i ert land
common_voice_sv-SE_18851016.wav,59948,är det sant
common_voice_sv-SE_18847838.wav,117548,jag vill bygga en stor generator
common_voice_sv-SE_18847663.wav,82988,svara i telefon peter
common_voice_sv-SE_18851023.wav,76844,du har ett uppdrag att utföra
common_voice_sv-SE_18851022.wav,106028,jag har länge sagt att de borde ge honom sparken
common_voice_sv-SE_18851019.wav,71468,hur besegrade de dig
common_voice_sv-SE_18847709.wav,84524,jag älskar den här stan
common_voice_sv-SE_18847696.wav,79148,de kan ju inte tillverka nånting
common_voice_sv-SE_18847707.wav,119084,tänk inte ens tanken på att ringa mig okej
common_voice_sv-SE_18851021.wav,86828,du behöver inte ens duscha idag
common_voice_sv-SE_18851025.wav,94508,området är väldigt isolerat
common_voice_sv-SE_18858223.wav,79148,nej jag har ju fotbollsträning
common_voice_sv-SE_18847710.wav,84524,för min ålder eller
common_voice_sv-SE_18847716.wav,106028,jag är här för att hämnas det är allt
common_voice_sv-SE_18847841.wav,115244,det där är du om två år kanske ett
common_voice_sv-SE_18847867.wav,86828,är det någon mer som blöder
common_voice_sv-SE_18858220.wav,94508,jag är så trött på den där jäkla familjen
common_voice_sv-SE_18847871.wav,73004,vi borde få panik
common_voice_sv-SE_18858225.wav,90668,jag har några dumma tankar om en ung tjej
common_voice_sv-SE_18858224.wav,106028,han kommer att se till att det inte blir lika illa igen
common_voice_sv-SE_18858233.wav,69164,det är dött
common_voice_sv-SE_18851018.wav,63788,säg att vi tar den
common_voice_sv-SE_18858238.wav,86828,han smälter nog ner det medan vi pratar
common_voice_sv-SE_18858237.wav,82988,då ger vi oss av till månen
common_voice_sv-SE_18858235.wav,92204,det är bara mer skit från tobaksgården
common_voice_sv-SE_18858769.wav,80684,men de åker till galaxen i stället
common_voice_sv-SE_18858767.wav,67628,är inte det din grej
common_voice_sv-SE_18851015.wav,106028,är inte killen som bor här din pojkvän
common_voice_sv-SE_18858228.wav,102188,jag betalade det jag blev tillsagd att betala
common_voice_sv-SE_18847839.wav,88364,var får vi det bästa priset
common_voice_sv-SE_18851028.wav,82988,då går jag någon annanstans
common_voice_sv-SE_18858227.wav,125228,då måste du skruva loss antennen för att aktivera strömbrytaren
common_voice_sv-SE_18851029.wav,75308,trots att jag ringde
common_voice_sv-SE_18847861.wav,84524,ja i alla fall i min skola
common_voice_sv-SE_18858782.wav,79148,jag kunde ha varit död nu
common_voice_sv-SE_18858771.wav,73004,du känner inte henne
common_voice_sv-SE_18851027.wav,159788,vad är galet med att ha en reservplan något de aldrig visste
common_voice_sv-SE_18858783.wav,122924,se till att ni har övning tre på min kateder i morgon
common_voice_sv-SE_18851026.wav,109868,vi vet vad vi ska satsa på för att vinna
common_voice_sv-SE_18858770.wav,76844,nej du ska gå hem
common_voice_sv-SE_18847857.wav,84524,du kan inte bara tillåta det
common_voice_sv-SE_18858784.wav,69164,du är frustrerad
common_voice_sv-SE_18851020.wav,117548,men det mesta av mänskligheten har blivit utplånad
common_voice_sv-SE_18858776.wav,67628,vi var så rädda
common_voice_sv-SE_18847858.wav,71468,du är så vacker
common_voice_sv-SE_18858794.wav,111404,beslut som leder oss från en dag till en annan
common_voice_sv-SE_18858772.wav,75308,ser du hur du talar till mig
common_voice_sv-SE_18858768.wav,73004,vart har de åkt
common_voice_sv-SE_18858793.wav,84524,har ni sett mina svärföräldrar
common_voice_sv-SE_18851024.wav,61484,det är ju viktigt
common_voice_sv-SE_18858802.wav,65324,vad är inuti
common_voice_sv-SE_18858803.wav,86828,de är mindre iögonfallande
common_voice_sv-SE_18858806.wav,88364,herregud jag skojade bara
common_voice_sv-SE_18858222.wav,59948,har du fler
common_voice_sv-SE_21363757.wav,99884,kom så drar vi
common_voice_sv-SE_21363755.wav,118316,de håller på att fälla träden
common_voice_sv-SE_21363758.wav,133676,men vi kanske kan rida tillsammans imorgon
common_voice_sv-SE_18858236.wav,122924,jag ligger risigt till om dom får reda på att jag tagit den
common_voice_sv-SE_18858804.wav,76844,vi åker och ser oss om
common_voice_sv-SE_18858226.wav,86828,jag försöker hindra dig att göra bort dig
common_voice_sv-SE_21363753.wav,178220,du ska ingenstans innan vi får informationen till borgmästaren
common_voice_sv-SE_18858773.wav,99884,jaha tillbaka från de döda
common_voice_sv-SE_21363772.wav,99884,jag kommer åt min laptop
common_voice_sv-SE_21363761.wav,76076,vi måste åka
common_voice_sv-SE_21363752.wav,107564,jag har fått nog
common_voice_sv-SE_18858796.wav,65324,tack ska du ha
common_voice_sv-SE_18847868.wav,153644,som ni vet har de senaste årtiondena varit svåra för mitt land
common_voice_sv-SE_21363776.wav,119852,på vilket sätt
common_voice_sv-SE_21363775.wav,161324,om ert namn har ropats ut stanna här
common_voice_sv-SE_21363780.wav,134444,hur fan kunde ni släppa honom lös
common_voice_sv-SE_21363784.wav,132140,jag såg det i hans ögon
common_voice_sv-SE_21363783.wav,112172,om tre år
common_voice_sv-SE_18858786.wav,92204,du hade behövt investera den tiden för länge sen
common_voice_sv-SE_21363779.wav,149036,använd hudkräm och drick vatten
common_voice_sv-SE_21363782.wav,86060,jag drömmer inte
common_voice_sv-SE_21363781.wav,166700,om du vill träna upp dig håll dig då till min plan
common_voice_sv-SE_21363786.wav,214316,jag har bett om att få askan från bilen till laboratoriet
common_voice_sv-SE_21363811.wav,132140,har ni flyttat eller något sånt
common_voice_sv-SE_21363793.wav,102188,hon är inte er målgrupp
common_voice_sv-SE_18858774.wav,130604,det var medvetet så hon skulle sluta vara så besatt
common_voice_sv-SE_18858221.wav,82988,jag är inget mer än klok och förnuftig
common_voice_sv-SE_21363791.wav,107564,du har redan gjort mitt jobb
common_voice_sv-SE_18858775.wav,115244,men varje konstnär behöver en tom duk
common_voice_sv-SE_21363756.wav,123692,jag vill genomsöka bilen
common_voice_sv-SE_21363778.wav,109100,spelar ingen roll
common_voice_sv-SE_21363799.wav,122156,inspektören ljug inte för mig
common_voice_sv-SE_18858785.wav,90668,jag kan hänga med dig men jag tänker bara titta
common_voice_sv-SE_21363792.wav,132140,vi måste till skrotupplaget
common_voice_sv-SE_18858791.wav,86828,jag kom tillbaka från istanbul i morse
common_voice_sv-SE_18858805.wav,79148,jag slog en kille med en vattendunk
common_voice_sv-SE_21363803.wav,112940,jag fick just veta
common_voice_sv-SE_21363798.wav,97580,det är ingen dröm
common_voice_sv-SE_21363800.wav,99116,de åker aldrig hem
common_voice_sv-SE_21363804.wav,118316,min far ska betala
common_voice_sv-SE_21363801.wav,137516,får jag se väskan
common_voice_sv-SE_21363807.wav,146732,för du vill väl stoppa om dem varje kväll pappsen
common_voice_sv-SE_21363838.wav,106028,ta din tid på dig
common_voice_sv-SE_21363809.wav,170540,vi ska nu dra oss tillbaka och överväga
common_voice_sv-SE_21363794.wav,82220,han var ju på kaféet
common_voice_sv-SE_21363806.wav,136748,tre år tidigare än våra uppgifter
common_voice_sv-SE_21363759.wav,86060,lätt att gömma
common_voice_sv-SE_21363814.wav,135212,vi kan plantera under torrperioden
common_voice_sv-SE_21363789.wav,225068,jag förvånas över att en präst tror på prat om förbannade smycken
common_voice_sv-SE_21363823.wav,133676,oavsett vem så hoppas jag han får glädje av det
common_voice_sv-SE_21363754.wav,162860,prova du att döda en ko så får du se hur du mår
common_voice_sv-SE_21363816.wav,195884,du måste låta mig göra min grej låta mig misslyckas eller lyckas
common_voice_sv-SE_21363817.wav,122156,jag ville bränna er båda
common_voice_sv-SE_18858795.wav,82988,föredrar ni asien
common_voice_sv-SE_21363827.wav,111404,så du är en stor man nu
common_voice_sv-SE_21363818.wav,94508,vad är det med dig
common_voice_sv-SE_21363831.wav,159020,vad sägs om fyra paket för kylskåpspengarna
common_voice_sv-SE_21363773.wav,108332,de var bland dina skor
common_voice_sv-SE_21363829.wav,109868,vad modiga ni är
common_voice_sv-SE_21363836.wav,107564,det är bara smärtstillande
common_voice_sv-SE_21363760.wav,176684,säg åt din far att betala annars kan du inte fortsätta här
common_voice_sv-SE_21363832.wav,155180,jag hyser den största aktning för dig
common_voice_sv-SE_21363824.wav,88364,det där är inte sant
common_voice_sv-SE_21363819.wav,84524,vi tar den här
common_voice_sv-SE_21363787.wav,120620,vi har en teckning av det här
common_voice_sv-SE_21363825.wav,132908,vi borde ha haft svensexan i budapest
common_voice_sv-SE_21363822.wav,92972,gör inte så
common_voice_sv-SE_21363820.wav,89900,får vi komma in
common_voice_sv-SE_21363845.wav,99884,in i pansarvagnen
common_voice_sv-SE_21363790.wav,92972,låt mig sköta det
common_voice_sv-SE_21363828.wav,119852,du måste gå på tunga mediciner
common_voice_sv-SE_21363843.wav,172076,vi kan expandera internationellt till nästa år
common_voice_sv-SE_21363859.wav,86060,jag har en affärsidé
common_voice_sv-SE_21363802.wav,159788,sen låter du mig dö i fred
common_voice_sv-SE_21363846.wav,89132,du är sjuk
common_voice_sv-SE_21363841.wav,125228,varför har du gett mig den ringtonen
common_voice_sv-SE_21363862.wav,115244,låt dig inte ryckas med
common_voice_sv-SE_21363777.wav,109868,han tycker att jag är äcklig
common_voice_sv-SE_21363821.wav,89900,de ska inte få veta något
common_voice_sv-SE_21363873.wav,99884,men jag är glad att du hittade mina stövlar
common_voice_sv-SE_21363870.wav,102188,du är inte kommissarie
common_voice_sv-SE_21363810.wav,93740,det ser fint ut
common_voice_sv-SE_21363872.wav,158252,går det bra att min bror är den som styr roboten
common_voice_sv-SE_21363796.wav,143660,lägg av jag försöker inte lura nån
common_voice_sv-SE_21363861.wav,90668,jag borde nog stanna här
common_voice_sv-SE_21363869.wav,134444,jag vill att ni ger mig en likvaka
common_voice_sv-SE_21363805.wav,109100,varför insisterar du på att jag är galen
common_voice_sv-SE_21363797.wav,158252,men sitt inte kedjade vid datorerna hela dagarna
common_voice_sv-SE_21363904.wav,110636,vi måste stoppa den innan dess
common_voice_sv-SE_21363882.wav,101420,och just då
common_voice_sv-SE_21363890.wav,145964,vi måste fixa så att vi kan läsa på kvällen
common_voice_sv-SE_21363837.wav,139820,men den som organiserar har inte kul
common_voice_sv-SE_21363774.wav,202028,hon sa något om att omrigga bomberna att kommunicera med varandra
common_voice_sv-SE_21363906.wav,104492,ja och jag behåller mina
common_voice_sv-SE_21363926.wav,82220,jag kan hjälpa dig
common_voice_sv-SE_21363905.wav,77612,jag är människa
common_voice_sv-SE_21363908.wav,132140,jag antar att din pojkvän lagar maten
common_voice_sv-SE_21363923.wav,83756,ge mig mjölk
common_voice_sv-SE_21363930.wav,102188,bara ingen har stulit dem
common_voice_sv-SE_21363924.wav,117548,känn på den
common_voice_sv-SE_21363925.wav,134444,nu kan han bara låta klockan ticka vidare
common_voice_sv-SE_21363931.wav,131372,mats som vägde tio ton
common_voice_sv-SE_21363929.wav,91436,som han sa
common_voice_sv-SE_21363960.wav,102188,jag älskar dina stövlar
common_voice_sv-SE_21363932.wav,179756,om du fortfarande vill begå självmord efteråt så går jag
common_voice_sv-SE_21363974.wav,128300,det är den unge mannens svensexa
common_voice_sv-SE_21363959.wav,127532,jag skulle ända vilja veta hur hela planen såg ut
common_voice_sv-SE_21363972.wav,114476,han tänker precis som annie
common_voice_sv-SE_21363830.wav,147500,jag är tvungen att gå hem från jobbet och prata med min familj
common_voice_sv-SE_21363933.wav,76844,ja för fan
common_voice_sv-SE_21363990.wav,120620,östblockets hemliga skatter
common_voice_sv-SE_21363826.wav,105260,jag är bra på att lyssna
common_voice_sv-SE_21363981.wav,176684,vanliga människor dör inom tre dagar om de andas in den
common_voice_sv-SE_21363992.wav,109868,man kan se det på teckningarna
common_voice_sv-SE_21363991.wav,110636,min man är på fisketur
common_voice_sv-SE_21363922.wav,103724,jag ska visa hur han gjorde
common_voice_sv-SE_21363993.wav,86060,du och jag
common_voice_sv-SE_21363863.wav,159020,du är en hård förhandlare men jag ska se vad jag kan göra
common_voice_sv-SE_21363989.wav,152108,inget du säger eller gör kan förhindra det
common_voice_sv-SE_21363885.wav,96044,min kollega bestämmer
common_voice_sv-SE_21364041.wav,109868,den kon var redan sjuk
common_voice_sv-SE_21364043.wav,76844,lugna ner dig
common_voice_sv-SE_21364046.wav,99884,trevligt att träffas
common_voice_sv-SE_21364039.wav,121388,jag slog mig på käften
common_voice_sv-SE_21363883.wav,82220,han gillar det visst
common_voice_sv-SE_21364040.wav,111404,jag har funderat på den här maskinen
common_voice_sv-SE_21364084.wav,96812,jag behöver några dagar till
common_voice_sv-SE_21364045.wav,100652,de jobbade hårt
common_voice_sv-SE_21363860.wav,153644,har du fått ihop tillräckligt för att behålla den eller inte
