wav_filename,wav_filesize,transcript
common_voice_sv-SE_19101863.wav,118316,det måste vara väl gömt för jag har aldrig sett det
common_voice_sv-SE_19101846.wav,79148,ledsen att göra dig besviken
common_voice_sv-SE_19101953.wav,92972,det är smart
common_voice_sv-SE_19101951.wav,96044,det såg han som ett tecken sen slog han till
common_voice_sv-SE_19101963.wav,77612,visst han är gullig
common_voice_sv-SE_19101974.wav,110636,har din gudmor något emot att jag deltar
common_voice_sv-SE_19101952.wav,104492,du måste skicka med ett meddelande så det sjunger
common_voice_sv-SE_19101969.wav,145964,så kanske vi inte ser på planerna utan slutresultatet
common_voice_sv-SE_19101871.wav,62252,jag måste följa med
common_voice_sv-SE_19101888.wav,62252,jag frågar bara
common_voice_sv-SE_19101979.wav,82220,förlåt men tusen tack
common_voice_sv-SE_19101962.wav,128300,du råkade bara vara på marknaden samtidigt
common_voice_sv-SE_19101985.wav,69164,det gör jag kanske inte
common_voice_sv-SE_19101849.wav,155180,vi överlevde tack vare ett andningssystem som vår farfar uppfann
common_voice_sv-SE_19101986.wav,83756,vi återvänder till jorden
common_voice_sv-SE_19101978.wav,86060,vi fortsätter i full fart
common_voice_sv-SE_19101950.wav,113708,jag har en senare bild här
common_voice_sv-SE_19101887.wav,95276,inte med alla problem här
common_voice_sv-SE_19101909.wav,69164,jag duger inte längre
common_voice_sv-SE_19101972.wav,88364,och ett år till nästa skörd
common_voice_sv-SE_19101992.wav,132908,och det var här annie mötte läraren och vi betalade för det
common_voice_sv-SE_19101882.wav,102956,demokrati är som importerad soppa
common_voice_sv-SE_19101955.wav,74540,var är den
common_voice_sv-SE_19101906.wav,142892,nu är konceptet inte bara att åka till budapest
common_voice_sv-SE_19101984.wav,89900,köp spannmål så mycket du kan
common_voice_sv-SE_19101991.wav,65324,jag blir bara trött
common_voice_sv-SE_19101973.wav,96044,låt oss inte förbättra deras liv
common_voice_sv-SE_19101910.wav,154412,det är som att ta bort en lampa från en serie julljus
common_voice_sv-SE_19101980.wav,79916,jag mår fint
common_voice_sv-SE_19101889.wav,81452,vad för jävla fråga är det
common_voice_sv-SE_19101971.wav,103724,kommer det leda till ett ovälkommet samtal
common_voice_sv-SE_19101905.wav,101420,det kan vara när vi körde på en mina
common_voice_sv-SE_19101964.wav,72236,okej där är det
common_voice_sv-SE_19102011.wav,102956,det är av yttersta vikt att det kommer tillbaka
common_voice_sv-SE_19102009.wav,161324,skapa uppståndelse om du vill men stanna hos din familj
common_voice_sv-SE_19102001.wav,76844,de är för mycket
common_voice_sv-SE_19101981.wav,83756,och att de gör det lyckliga
common_voice_sv-SE_19102039.wav,74540,de är snart här
common_voice_sv-SE_19101982.wav,142892,skyller du det på mig
common_voice_sv-SE_19101988.wav,74540,han litade inte på mig
common_voice_sv-SE_19101989.wav,102188,vi kommer att ångra det hemma i paris
common_voice_sv-SE_19101983.wav,92204,inser du att jag rånar dig
common_voice_sv-SE_19101987.wav,112172,ingen är ansvarig för den här mannens död
common_voice_sv-SE_19102049.wav,122156,när vi slutar blöda lider vi ändå
common_voice_sv-SE_19102008.wav,87596,ni borde nog hosta upp
common_voice_sv-SE_19102000.wav,97580,men den kändes som nån annans
common_voice_sv-SE_19101961.wav,66092,vi behöver polisen
common_voice_sv-SE_19101990.wav,70700,det hade jag glömt
common_voice_sv-SE_19102063.wav,84524,han berättar även om platsen
common_voice_sv-SE_19102002.wav,79916,ja den mystiske ryssen
common_voice_sv-SE_19102037.wav,76844,till och med hunden är trist
common_voice_sv-SE_19102026.wav,92972,och nu har vi våra egna krav
common_voice_sv-SE_19102075.wav,153644,jag skickar det till teknikerna så får vi en kopia senare
common_voice_sv-SE_19101999.wav,115244,jag hör av mig om det sker något nytt
common_voice_sv-SE_19102027.wav,93740,du måste tänka på framtiden
common_voice_sv-SE_19102036.wav,81452,flyg ut ur fönstret
common_voice_sv-SE_19101997.wav,81452,du kan sortera skit
common_voice_sv-SE_19102050.wav,71468,jag vill påminna er ibland
common_voice_sv-SE_19102023.wav,128300,jag missbedömde honom eftersom jag inte lyssnade
common_voice_sv-SE_19102094.wav,101420,ingen har bott där på flera år
common_voice_sv-SE_19102012.wav,86060,kommer alltid att göra det
common_voice_sv-SE_19102051.wav,112940,jag blir vad jag var ämnad att vara
common_voice_sv-SE_19102034.wav,214316,överbefälhavaren går uppför trappan med nåt som ser ut som toalettpapper under skon
common_voice_sv-SE_19102096.wav,96812,du ska få dina pengar okej
common_voice_sv-SE_19102065.wav,66092,det vore trevligt
common_voice_sv-SE_19102025.wav,102956,du ska veta att det är du som har fel
common_voice_sv-SE_19102088.wav,101420,jag hjälpte dig att ta bort din piercing
common_voice_sv-SE_19102107.wav,148268,om du vet att det fungerar varför inte ta din fars cykel
common_voice_sv-SE_19102064.wav,169772,som vincent och jag måste smörja så att allt går smidigt
common_voice_sv-SE_19102042.wav,67628,sen vad då
common_voice_sv-SE_19102073.wav,124460,de tycks borra sig ner mot oss
common_voice_sv-SE_19102089.wav,86060,okej jag tar den
common_voice_sv-SE_19102076.wav,91436,du behöver inte vända om
common_voice_sv-SE_19102092.wav,90668,om jag sticker hamnar jag i trubbel
common_voice_sv-SE_19102091.wav,74540,vi har tänkt laga den
common_voice_sv-SE_19102067.wav,74540,det är klart
common_voice_sv-SE_19102098.wav,115244,tack galna möhippan
common_voice_sv-SE_19102074.wav,69932,är du hungrig
common_voice_sv-SE_19102066.wav,97580,ja jag har bara
common_voice_sv-SE_19102077.wav,77612,vi ser efter oss själva
common_voice_sv-SE_19102090.wav,79148,bara så där
common_voice_sv-SE_19102124.wav,77612,sätt på kranen
common_voice_sv-SE_19102125.wav,115244,det är kanske därför hon inte är med mig nu
common_voice_sv-SE_19102146.wav,86828,det är bra
common_voice_sv-SE_19102122.wav,63788,tja du vet
common_voice_sv-SE_19102048.wav,73772,fes du precis
common_voice_sv-SE_19102100.wav,94508,för du är en fara för dig själv
common_voice_sv-SE_19102102.wav,69164,klockan tio
common_voice_sv-SE_19102105.wav,94508,mina äggledare mår jättebra
common_voice_sv-SE_19102121.wav,81452,har du något att säga till dem
common_voice_sv-SE_20020962.wav,118316,den var vidrig och korkad
common_voice_sv-SE_19102106.wav,81452,fast med en kvinna
common_voice_sv-SE_20020968.wav,119084,jag fick ner det till sex miljoner
common_voice_sv-SE_20020966.wav,80684,hon borde dö
common_voice_sv-SE_19102118.wav,135980,du borde ha insisterat på att hon skulle komma
common_voice_sv-SE_19102136.wav,100652,jag ville bara att du skulle se det
common_voice_sv-SE_20020991.wav,86060,jag är också hög
common_voice_sv-SE_20020963.wav,84524,är det möjligt
common_voice_sv-SE_19102120.wav,69932,jag har stånd
common_voice_sv-SE_19102145.wav,102188,vi kan resa dit och gifta oss
common_voice_sv-SE_19102137.wav,79916,vad står på
common_voice_sv-SE_20020998.wav,92204,nu ska jag vara ärlig
common_voice_sv-SE_19102134.wav,87596,står det vem som köpte det
common_voice_sv-SE_19102123.wav,116780,det är flera möjliga detonatorer
common_voice_sv-SE_19102104.wav,104492,det heter fiskar i plural
common_voice_sv-SE_20021027.wav,102188,är du verkligen så galen
common_voice_sv-SE_19102126.wav,66092,vi tar den
common_voice_sv-SE_19102133.wav,103724,de går till ett stort batteri
common_voice_sv-SE_20020967.wav,130604,vad får dig att tro att jag behöver din hjälp
common_voice_sv-SE_19102135.wav,96044,återigen ingen hjälp
common_voice_sv-SE_20021039.wav,82988,är du galen
common_voice_sv-SE_19102147.wav,79148,får jag känna
common_voice_sv-SE_19102119.wav,135212,så att han inte berövar barnen på mat
common_voice_sv-SE_20021058.wav,98348,hon pratar i sin morgonrock
common_voice_sv-SE_20021055.wav,86060,han är en lögnare
common_voice_sv-SE_20021079.wav,102956,så detta är den kända
common_voice_sv-SE_19102143.wav,99116,det här är konkret
common_voice_sv-SE_19102144.wav,92972,jag borde få en del för det
common_voice_sv-SE_19102127.wav,89132,du behöver en sista måltid
common_voice_sv-SE_20020995.wav,99116,kommer jag att bli kidnappad
common_voice_sv-SE_20021024.wav,123692,vi ska välta er borgarsvin
common_voice_sv-SE_20020993.wav,129068,vi är beredda att göra oss hörda i valet
common_voice_sv-SE_20021098.wav,88364,det är din förlust
common_voice_sv-SE_20021044.wav,90668,här är ett täcke
common_voice_sv-SE_20021041.wav,99884,svara du
common_voice_sv-SE_20021025.wav,102188,det är ingen fara älskling
common_voice_sv-SE_20021000.wav,119852,hon kanske aldrig blir den person jag kände
common_voice_sv-SE_20021197.wav,109100,förlåt mobilen ringer
common_voice_sv-SE_20021097.wav,159788,då har vi flyghotellrestaurangmassagepaketet
common_voice_sv-SE_20021043.wav,103724,nu är företaget mitt
common_voice_sv-SE_20021057.wav,102956,man kan se det på teckningarna
common_voice_sv-SE_20021026.wav,109868,ska vi kanske öka insatsen
common_voice_sv-SE_20021040.wav,106796,jag behöver några dagar till
common_voice_sv-SE_20021028.wav,90668,du är för att vi går
common_voice_sv-SE_20021096.wav,102188,och skurken är så här
common_voice_sv-SE_20021232.wav,149036,men inte att hon skulle vara så avväpnande
common_voice_sv-SE_20021202.wav,95276,varför just jag
common_voice_sv-SE_20021252.wav,116012,vi har dragit in femtiotusen
common_voice_sv-SE_20021095.wav,156716,från balkongen kan jag se taken på er familjeegendom
common_voice_sv-SE_20021195.wav,107564,men du bryter mot lagen
common_voice_sv-SE_20021054.wav,123692,de flesta får något efter livet
common_voice_sv-SE_20021081.wav,97580,jag måste tyvärr gå nu
common_voice_sv-SE_20021080.wav,83756,hon är advokat
common_voice_sv-SE_20021094.wav,97580,skölden är för kraftfull
common_voice_sv-SE_20021083.wav,95276,får jag se väskan
common_voice_sv-SE_20021296.wav,81452,jag kan det
common_voice_sv-SE_20021253.wav,116780,nej hon är hos veterinären
common_voice_sv-SE_20021314.wav,101420,var snäll och tro på mig
common_voice_sv-SE_20021297.wav,110636,vi tar hit grabbarna dagen efter
common_voice_sv-SE_20021295.wav,96044,jo just han
common_voice_sv-SE_20021205.wav,97580,vart vill du åka
common_voice_sv-SE_20021337.wav,85292,tack för att ni tittar
common_voice_sv-SE_20021335.wav,79916,kul att se dig
common_voice_sv-SE_20021082.wav,100652,den är stabiliserad
common_voice_sv-SE_20021312.wav,99884,bara om man åker fast
common_voice_sv-SE_20021056.wav,82988,mår du bra
common_voice_sv-SE_20021349.wav,89132,men det är snabbt fixat
common_voice_sv-SE_20021200.wav,112940,okej jag knäpper av båda
common_voice_sv-SE_20021230.wav,124460,östblockets hemliga skatter
common_voice_sv-SE_20021231.wav,119852,varför försöker du alltid mata mig
common_voice_sv-SE_20021251.wav,116780,föreställningen är först i morgon
common_voice_sv-SE_20021234.wav,90668,inte just nu
common_voice_sv-SE_20021300.wav,85292,det är ingen dröm
common_voice_sv-SE_20021233.wav,126764,vi kan plantera under torrperioden
common_voice_sv-SE_20021311.wav,101420,de var bland dina skor
common_voice_sv-SE_20021374.wav,76076,vart ska du
common_voice_sv-SE_20021254.wav,188972,fälla eller inte om alfred är där inne måste jag få veta det
common_voice_sv-SE_20021336.wav,85292,ja vad är det
common_voice_sv-SE_20021370.wav,119084,jag tror inte att hon menade det sista
common_voice_sv-SE_20021313.wav,106028,jag har funderat på att skaffa hund
common_voice_sv-SE_20021371.wav,93740,var är pengarna lebowski
common_voice_sv-SE_20021250.wav,165932,inte om du berättar att marken snart är under vatten
common_voice_sv-SE_20021384.wav,105260,jag måste vara med min far
common_voice_sv-SE_20021339.wav,83756,jag bryr mig fan inte
common_voice_sv-SE_20021298.wav,92972,jag vet inte säkert
common_voice_sv-SE_20021381.wav,182060,även om det skulle vara ett konkurrerande företag är syftet oklart
common_voice_sv-SE_20021362.wav,80684,vad i helvete
common_voice_sv-SE_20021386.wav,109100,regnbågen är överskattad
common_voice_sv-SE_20021394.wav,157484,jag kan inte skicka en räkning till kinesen som pissade på mattan
common_voice_sv-SE_20021346.wav,89132,vad häftig du är brorsan
common_voice_sv-SE_20021373.wav,99116,kan du hjälpa oss daniel
common_voice_sv-SE_20021393.wav,116012,jag måste komma i min enda kostym
common_voice_sv-SE_20021363.wav,89900,han mådde inte bra
common_voice_sv-SE_20021347.wav,93740,det är rent osmakligt
common_voice_sv-SE_20021350.wav,92204,du har inte skött dig ser jag
common_voice_sv-SE_20021380.wav,120620,jag vet inte hur jag ska förklara det
common_voice_sv-SE_20021361.wav,135212,vår tjuv tycks ha tagit sin belöning trots allt
common_voice_sv-SE_20021338.wav,65324,skynda dig
common_voice_sv-SE_20021360.wav,78380,och just då
common_voice_sv-SE_20021416.wav,109868,jag skiter i var max är
common_voice_sv-SE_20021345.wav,96044,jag slog mig på käften
common_voice_sv-SE_20021426.wav,99116,ingen får bli skadad
common_voice_sv-SE_20021425.wav,136748,det är en iakttagelse som du kan ha nytta av
common_voice_sv-SE_20021364.wav,81452,jag har fått nog
common_voice_sv-SE_20021372.wav,86060,är han det än
common_voice_sv-SE_20021310.wav,137516,jag går gärna till en klubb om du menar det
common_voice_sv-SE_20021391.wav,97580,lycka till allihop
common_voice_sv-SE_20021390.wav,100652,du är sjukare än din bror
common_voice_sv-SE_20021450.wav,90668,gör det lättare att sälja
common_voice_sv-SE_20021413.wav,123692,vi fattar flera beslut varje dag
common_voice_sv-SE_20021417.wav,134444,i går när han gick på planet i minneapolis
common_voice_sv-SE_20021449.wav,150572,det har varit svåra tider förut för tjugo år sedan
common_voice_sv-SE_20021382.wav,135980,går det bra att min bror är den som styr roboten
common_voice_sv-SE_20021452.wav,102188,hon började le så här
common_voice_sv-SE_20021447.wav,91436,det är naturligt
common_voice_sv-SE_20021453.wav,142124,tyvärr hade den redan stulits innan jag kom dit
common_voice_sv-SE_20021412.wav,94508,de gör mig förbannad
common_voice_sv-SE_20021408.wav,145964,jag fick knappt ut svensexa förrän hon sågade idén
common_voice_sv-SE_20021465.wav,112172,alfred du är starkare än han
common_voice_sv-SE_20021415.wav,86060,vi kollar upp det
common_voice_sv-SE_20021461.wav,171308,du lät aldrig mig prata på åratal
common_voice_sv-SE_20021468.wav,106028,synd han är ju där
common_voice_sv-SE_20021445.wav,94508,du ska inte flyga
common_voice_sv-SE_20021410.wav,88364,nej skit i henne
common_voice_sv-SE_20021429.wav,106028,de håller på att fälla träden
common_voice_sv-SE_20021508.wav,100652,du tog dem på efterfest
common_voice_sv-SE_20021392.wav,96044,vill du arbeta med oss
common_voice_sv-SE_20021428.wav,148268,hövdingen gör som han vill och jag gör som jag vill
common_voice_sv-SE_20021466.wav,83756,det var en fälla
common_voice_sv-SE_20021502.wav,100652,gick ni aldrig på college
common_voice_sv-SE_20021419.wav,92972,han ska just gå
common_voice_sv-SE_20021448.wav,88364,du måste hjälpa mig
common_voice_sv-SE_20021451.wav,82220,jag ber om mycket
common_voice_sv-SE_20021418.wav,93740,jag brukar jobba ute på lagret
common_voice_sv-SE_20021500.wav,107564,betyder det att du förlåtit mig
common_voice_sv-SE_20021471.wav,123692,regeringen förnekar matkrisen
common_voice_sv-SE_20021462.wav,84524,som han sa
common_voice_sv-SE_20021460.wav,73004,ställ in
common_voice_sv-SE_20021526.wav,98348,det var inte frågan
common_voice_sv-SE_20021464.wav,82988,är hon gravid
common_voice_sv-SE_20021414.wav,95276,nej det går inte
common_voice_sv-SE_20021427.wav,97580,men jag vet var den är
common_voice_sv-SE_20021463.wav,82220,jag mår inte bra
common_voice_sv-SE_20021618.wav,112940,för betalningen får du tala med lars
common_voice_sv-SE_20021521.wav,89900,jag gjorde mig illa
common_voice_sv-SE_20021446.wav,126764,det är upp till oss att förändra framtiden
common_voice_sv-SE_20021454.wav,94508,får vi komma in
common_voice_sv-SE_20021469.wav,131372,det har varit ett nöje att göra er bekantskap
common_voice_sv-SE_20021619.wav,128300,två saker min bror aldrig värderade
common_voice_sv-SE_20021613.wav,107564,jag ville bara göra en sak idag
common_voice_sv-SE_20021504.wav,141356,oavsett vem så hoppas jag han får glädje av det
common_voice_sv-SE_20021506.wav,89900,var är min son
common_voice_sv-SE_20021503.wav,88364,de jobbade hårt
common_voice_sv-SE_20021628.wav,96812,jag pratar med min man
common_voice_sv-SE_20021610.wav,99884,jag känner dig nästan
common_voice_sv-SE_20021627.wav,109100,det här är antibiotika
common_voice_sv-SE_20021641.wav,89900,jag sumpade det
common_voice_sv-SE_20021501.wav,70700,får jag se
common_voice_sv-SE_20021507.wav,102188,varför sa du inget till mig
common_voice_sv-SE_20021505.wav,105260,jag talade från hjärtat
common_voice_sv-SE_20021608.wav,94508,låt henne göra det då
common_voice_sv-SE_20021510.wav,129068,hollywood lär knappast behålla dig länge till
common_voice_sv-SE_20021615.wav,118316,ja jag tog många liv förra veckan
common_voice_sv-SE_20021670.wav,87596,de är helt galna
common_voice_sv-SE_20021520.wav,100652,och dina underbara kläder
common_voice_sv-SE_20021662.wav,112940,inte något oöverstigligt problem
common_voice_sv-SE_20021682.wav,92204,har du en terapeut
common_voice_sv-SE_20021625.wav,117548,det blir en gång i livet för honom
common_voice_sv-SE_20021524.wav,149036,var det galenskaper när hon gjorde utbyggnaden
common_voice_sv-SE_20021679.wav,156716,den svarta röken som den avger är full av giftiga ämnen
common_voice_sv-SE_20021642.wav,115244,akta så att du inte krockar
common_voice_sv-SE_20021616.wav,87596,det där vet jag inte
common_voice_sv-SE_20021700.wav,103724,ett stulet halsband
common_voice_sv-SE_20021629.wav,131372,ja för att återfå ett stulet föremål
common_voice_sv-SE_20021643.wav,75308,vad är det nu
common_voice_sv-SE_20021663.wav,91436,för vi har en bra idé
common_voice_sv-SE_20021708.wav,109868,han verkar ha betalt notan
common_voice_sv-SE_20021626.wav,101420,det här är sista gången
common_voice_sv-SE_20021611.wav,89132,jag är människa
common_voice_sv-SE_20021667.wav,97580,jag behöver ett gott råd
common_voice_sv-SE_20021606.wav,90668,jag avundas dig
common_voice_sv-SE_20021681.wav,99884,jag fick gå i skolan
common_voice_sv-SE_20021680.wav,87596,du drog ju
common_voice_sv-SE_20021666.wav,110636,vi måste härifrån
common_voice_sv-SE_20021617.wav,80684,är ni redo
common_voice_sv-SE_20021645.wav,122156,men jag är glad att du hittade mina stövlar
common_voice_sv-SE_20021678.wav,86828,jag vill inte höra
common_voice_sv-SE_20021738.wav,134444,har ingen smak och löser sig i alkohol
common_voice_sv-SE_20021701.wav,112940,är du någon slags fiskexpert
common_voice_sv-SE_20021640.wav,127532,det är bara en dörr här som behöver öppnas
common_voice_sv-SE_20021755.wav,89132,han lever än
common_voice_sv-SE_20021710.wav,95276,ge mig din telefon
common_voice_sv-SE_20021702.wav,106796,han borde betala mattjäveln
common_voice_sv-SE_20021756.wav,98348,du skulle se min källare
common_voice_sv-SE_20021762.wav,122924,för att man skulle få allvarliga bekymmer
common_voice_sv-SE_20021758.wav,82220,gräv upp mig
common_voice_sv-SE_20021714.wav,205100,utryckningspersonalen finns på plats jag vill ha brottsplatsutredarna där genast
common_voice_sv-SE_20021712.wav,93740,vad modiga ni är
common_voice_sv-SE_20021739.wav,119852,du ser ännu bättre ut i verkligheten
common_voice_sv-SE_20021801.wav,145964,och aldrig sett drottningen i underbyxor som man säger
common_voice_sv-SE_20021760.wav,190508,den är på väg till parlamentsbyggnaden för att inleda atmosfärsomvandlingen
common_voice_sv-SE_20021699.wav,152108,världen är på väg mot en moralisk avgrund fader
common_voice_sv-SE_20021741.wav,135980,om du klantar dig mer får du smaka blysås
common_voice_sv-SE_20021770.wav,81452,ta din tid på dig
common_voice_sv-SE_20021800.wav,159788,det är inte det bästa karriärsvalet men det betalar hyran
common_voice_sv-SE_20021802.wav,116780,jag vill inte ha en massa poliser i huset
common_voice_sv-SE_20105064.wav,165164,på kvällarna tar vi er till de hetaste ställena i budapest
common_voice_sv-SE_20105059.wav,167468,om jag fortsätter snacka skit så fastnar kanske något
common_voice_sv-SE_20105061.wav,136748,jag kollar sovrummen på övervåningen
common_voice_sv-SE_20105063.wav,116012,det skulle vara helt i hans stil
common_voice_sv-SE_20105057.wav,102188,när är mötet
common_voice_sv-SE_20021740.wav,76844,jag står över
common_voice_sv-SE_20021717.wav,89132,det är understruket
common_voice_sv-SE_20021742.wav,149036,jag har bett om att få askan från bilen till laboratoriet
common_voice_sv-SE_20021698.wav,107564,de har sina planer och
common_voice_sv-SE_20021777.wav,102188,jag älskar dig hjärtat
common_voice_sv-SE_20190016.wav,92972,jag har inga läxor
common_voice_sv-SE_20190012.wav,155180,bara så ni vet är den här byggnaden inom explosionsradien
common_voice_sv-SE_20105058.wav,120620,du ska lämna min planet
common_voice_sv-SE_20190011.wav,106796,men gårdagen var lika hemsk
common_voice_sv-SE_20105067.wav,112940,vi skulle bo på en vingård
common_voice_sv-SE_20021799.wav,83756,vad gör ni
common_voice_sv-SE_20190013.wav,117548,plötsligt var det ben och armar överallt
common_voice_sv-SE_20190018.wav,96812,något som minner om dig
common_voice_sv-SE_20021776.wav,82988,jag vet vad du gör
common_voice_sv-SE_20190020.wav,83756,hur mår agnes
common_voice_sv-SE_20190015.wav,81452,det är över nu
common_voice_sv-SE_20190014.wav,78380,vart du gå
common_voice_sv-SE_20105062.wav,133676,vi borde ha haft svensexan i budapest
common_voice_sv-SE_20190024.wav,113708,jag har ett möte i london
common_voice_sv-SE_20190025.wav,112940,jag ska berätta hemligheten för dig
common_voice_sv-SE_20105070.wav,97580,ge er på mig då
common_voice_sv-SE_20190022.wav,162860,jag tjänade en smärre förmögenhet i obetalda biljetter
common_voice_sv-SE_20190023.wav,109100,bara ni båda slutar prata
common_voice_sv-SE_20021772.wav,98348,ja känner du honom
common_voice_sv-SE_20021796.wav,120620,det är den unge mannens svensexa
common_voice_sv-SE_20190029.wav,156716,vad anser du om mikrodoser av psykedeliska droger
common_voice_sv-SE_20190028.wav,161324,alldeles för många män klättrar på varandra för att rädda henne
common_voice_sv-SE_20190044.wav,89132,vill ni ta ett dopp
common_voice_sv-SE_20105066.wav,102956,du är den enda talaren
common_voice_sv-SE_20105065.wav,115244,ska jag kolla upp mat och överdoser
common_voice_sv-SE_20105056.wav,175148,en verksam demokrati yttrandefrihet
common_voice_sv-SE_20021774.wav,116012,hur många barn har du hjärtat
common_voice_sv-SE_20190042.wav,94508,tänker du räkna
common_voice_sv-SE_20190051.wav,122924,tvillingbror till vår tidigare partner
common_voice_sv-SE_20190050.wav,99884,du får kyssa bruden
common_voice_sv-SE_20190054.wav,86828,vad är det här för något
common_voice_sv-SE_20190056.wav,91436,har du glömt vår dejt
common_voice_sv-SE_20190070.wav,106028,hon såg dig på min instagram
common_voice_sv-SE_20190052.wav,118316,böj på knäna och vänd upp händerna
common_voice_sv-SE_20105069.wav,135212,när flyttade sjukhuset in i nya lokaler
common_voice_sv-SE_20105060.wav,114476,behöver jag inte be om ursäkt
common_voice_sv-SE_20190055.wav,103724,vad du skulle tycka
common_voice_sv-SE_20105068.wav,103724,låt oss höra på hans plan
common_voice_sv-SE_20190040.wav,84524,nu sover vi
common_voice_sv-SE_20190027.wav,110636,gulligare än jag brukar dejta
common_voice_sv-SE_20190017.wav,90668,jag är bra på det här
common_voice_sv-SE_20190086.wav,86828,han krossar min hand
common_voice_sv-SE_20190019.wav,86060,låt mig bara vara
common_voice_sv-SE_20190106.wav,71468,det är iväg
common_voice_sv-SE_20190073.wav,137516,han gillar definitivt inte vapen eller hur
common_voice_sv-SE_20190071.wav,171308,en av brytarna kan vara den superladdade idiotsäkra
common_voice_sv-SE_20190057.wav,102956,låt bombgruppen sköta det
common_voice_sv-SE_20190021.wav,215084,de flesta labyrinter är konstruerade som närliggande linjer längs koncentriska cirklar
common_voice_sv-SE_20190095.wav,82220,det är din skiva
common_voice_sv-SE_20190041.wav,99116,regeringen kommer att skydda dem
common_voice_sv-SE_20190087.wav,79916,vi är på alla
common_voice_sv-SE_20190010.wav,82220,se på dig
common_voice_sv-SE_20190094.wav,116012,var försiktig när du använder den
common_voice_sv-SE_20190089.wav,102956,den är i alligatorskinn
common_voice_sv-SE_20190098.wav,150572,det är lustigt för i slutändan hamnade vi på samma ställe
common_voice_sv-SE_20190097.wav,88364,det är massor av plats
common_voice_sv-SE_20190058.wav,128300,kanske han inte är så hopplös som jag trodde
common_voice_sv-SE_20190093.wav,93740,hör du inte vad jag säger
common_voice_sv-SE_20190105.wav,102188,jag ska nog ta något sött
common_voice_sv-SE_20190083.wav,110636,jag trodde mest att du undvek mig
common_voice_sv-SE_20190096.wav,76076,vill ni prova
common_voice_sv-SE_20190102.wav,145964,jo för vi startar vårt företag det måste han
common_voice_sv-SE_20190100.wav,115244,ja om ni bara sjunger ihop är det okej
common_voice_sv-SE_20190072.wav,95276,lovar du det
common_voice_sv-SE_20190101.wav,99884,arbetare blev skadade
common_voice_sv-SE_20190026.wav,134444,kan du bygga en sån stor robot åt mig en dag
